first_name,last_name,email_address,mobile_no,address,contact_owner_id
Isobel,Mayert,,1-888-708-6954,"Lorna Falls, Lilafort, NSW, 39077",20001
Regan,Hermann,,855-699-0055,"Gardner Square, East Dino, NSW, 19292",20006
Raphael,Okuneva,,800-209-6680,"Britney Mountain, Lake Waino, TAS, 65288",20005
Aileen,Gorczany,,1-800-530-6230,"Jayme Trail, Lake Rebamouth, QLD, 68254",20004
Joan,Spencer,,877.888.9099,"Sawayn Ford, East Gudrunmouth, VIC, 54931",20001
Luther,Fadel,,866.740.2078,"Rice Passage, Kennithport, TAS, 78741",20004
Kirsten,Cronin,,866.741.4622,"Keon Street, New Afton, VIC, 65121",20004
Nick,Gerlach,,(855) 293-2624,"Vita Courts, Port Walton, QLD, 95833",20003
Idella,Hills,,888.930.2578,"Camryn Prairie, Port Heloise, SA, 25533",20005
Sonya,King,,1-855-534-2187,"Estevan Islands, Sporerport, VIC, 95030",20004
Malika,Kris,,844.273.6774,"Jonathon Viaduct, New Dejaland, ACT, 86792",20002
Breana,Konopelski,,877-723-4936,"Gusikowski Plaza, Jamaalbury, ACT, 67089",20004
Leola,Schaefer,,877-542-3543,"Renee Pike, Kreigerland, WA, 55106",20004
Hallie,Metz,,(888) 390-7436,"Frederik Knoll, Omariberg, NT, 51491",20005
Daniella,Ernser,,1-888-534-9270,"Barton Square, Port Janessa, SA, 12786",20003
Kelton,Spencer,,1-844-847-6952,"Chaya Points, East Letachester, VIC, 53065",20002
Saige,Lubowitz,,(855) 246-5853,"Wisoky Ridge, Marquardtmouth, ACT, 48481",20007
Edwardo,Grant,,866-436-5934,"Dorris Fields, South Audreanneberg, WA, 36663",20005
Sibyl,Ernser,,(877) 972-7071,"Travon Plain, New Mandy, NT, 63090",20002
Theron,Treutel,,(844) 597-0940,"Ryan Well, Lake Justus, VIC, 70596",20005
Linnea,Becker,,(844) 419-5231,"Mckenna Ways, South Maverickfort, ACT, 2476",20005
Foster,Dietrich,,(800) 239-0849,"Bernier Trafficway, Terrenceview, SA, 25555",20006
Ralph,Bahringer,,844.667.6600,"Jay Key, East Kamille, TAS, 61992",20005
Abigayle,Hagenes,,800-219-7135,"Mathew Walk, Gulgowskiburgh, ACT, 52313",20001
Jane,Friesen,,(877) 761-7981,"Kennedy Pike, South Felicitaview, TAS, 18018",20004
Telly,Haley,,877.869.2730,"Dillan Plains, South Darby, TAS, 52934",20005
Jamarcus,Rippin,,(866) 962-0838,"Pat Ville, Bechtelarside, NSW, 92956",20005
Karine,Pagac,,1-877-398-6214,"Yost Fields, Lake Carter, NT, 82567",20001
Markus,Strosin,,866-633-1996,"Hanna Pass, Paucekside, ACT, 66996",20001
Alfonzo,Gleichner,,866-657-2713,"Legros Mall, Tadborough, QLD, 8093",20001
Reba,Bins,,844-509-1030,"Kieran Drive, Ziemeberg, NT, 11724",20005
Joaquin,Hudson,,1-844-258-5190,"Streich View, Giannifurt, SA, 21153",20005
Andre,Volkman,,844-892-0069,"Pollich Locks, Kassulkebury, WA, 93545",20002
Bruce,Koss,,866-420-0457,"Armstrong Springs, West Lillieburgh, VIC, 56600",20006
Marjory,Swaniawski,,866-809-5140,"Jaquelin Mall, West Shermanland, VIC, 30368",20005
Pinkie,VonRueden,,877.891.7064,"Kaylie Mill, New Holly, VIC, 15502",20007
Neoma,Murray,,(877) 393-6632,"Emely Estate, Port Harry, NSW, 80399",20001
Luna,Goyette,,855.809.6940,"Howe Ridge, Karinaberg, QLD, 35141",20003
Rubye,Hagenes,,800-987-3848,"Elian Viaduct, Jaskolskitown, SA, 24880",20002
Eve,Lubowitz,,866.923.6464,"Abby Walks, Gerardport, QLD, 61518",20007
Bertrand,Collier,,866-671-4276,"Gottlieb Pike, McGlynnborough, QLD, 83457",20005
Avery,Fritsch,,866-368-0709,"Metz Court, Nettiehaven, QLD, 94847",20006
Darian,Ernser,,(866) 756-9935,"Beier Manor, Lake Raymond, TAS, 56124",20003
Audie,Zieme,,1-844-651-8997,"Christiansen Place, Jeremyview, QLD, 35600",20002
Paxton,Wehner,,(855) 248-8817,"Wilkinson Well, Gailborough, WA, 47409",20003
Marcelino,Gleason,,(888) 365-1274,"Cora Plaza, Dewaynechester, QLD, 85598",20002
Robbie,Nikolaus,,(800) 873-8251,"Ritchie Route, Yadiramouth, NSW, 6660",20003
Gabrielle,Brekke,,(844) 915-5861,"Don Junctions, Lake Melodyport, QLD, 70250",20004
Alessandra,Marvin,,(800) 423-7946,"Harley Gateway, West Ulicesbury, QLD, 1159",20001
Maiya,Padberg,,888.636.1632,"April Centers, Leonorfurt, NT, 78985",20003
Lloyd,Hartmann,,844-690-2972,"Botsford Field, Port Lou, TAS, 43954",20005
Shawna,Shanahan,,877-676-7472,"Hodkiewicz Lane, Garrettstad, TAS, 90674",20002
Cristopher,Green,,888.517.3074,"Karelle Route, North Adolfoton, WA, 96439",20002
Cali,Bechtelar,,866-299-1100,"Shanahan Knolls, Millsburgh, SA, 30252",20004
Jennie,Langworth,,800-629-3967,"Rodriguez Inlet, New Santinomouth, SA, 77905",20006
Gay,Zemlak,,1-844-796-8542,"Nicolette Islands, Wardberg, WA, 60661",20007
Rowland,Murphy,,1-888-932-6023,"Terrell Ferry, West Lorenzastad, ACT, 68072",20001
Darion,Upton,,855.618.1562,"Clara Plains, Dominiqueview, TAS, 19822",20001
Candice,Zulauf,,(800) 392-1521,"Kristin Squares, West Heatherhaven, SA, 57347",20006
Juwan,McDermott,,1-844-403-7983,"Delbert Junctions, Grahamshire, WA, 95898",20002
Maci,Rosenbaum,,866-265-5388,"Dooley Bypass, Dooleyberg, WA, 43133",20007
Brooke,Ledner,,(866) 442-3010,"White Way, Kreigershire, WA, 27274",20001
Dalton,Considine,,877.828.1393,"Russel Mission, South Genevieve, NSW, 79580",20006
Kallie,Macejkovic,,(800) 376-2145,"Frances Hollow, O'Connelltown, NSW, 52932",20004
Juliana,Gleason,,1-877-850-8996,"Howe Terrace, Hermistonmouth, TAS, 87826",20001
Helene,Schmidt,,866-445-9351,"Lowe Fork, Talonport, VIC, 7094",20001
Odie,Bechtelar,,1-844-672-8471,"Helena Squares, Lake Isabellaville, VIC, 33799",20005
Blake,Wilderman,,877.471.0942,"Mckayla Estate, Marialand, NT, 75016",20006
Will,Gerlach,,1-888-907-9117,"Nolan Mill, Vernaport, QLD, 47782",20006
Colten,Stroman,,866.798.0563,"Jacobson Lodge, Rupertborough, ACT, 76401",20005
Effie,West,,888-627-8515,"Aric Brooks, Isaiaston, QLD, 82016",20001
Lelia,Kub,,(877) 201-0842,"Cummerata Mountains, Port Cloyd, NSW, 7191",20004
Edna,Boehm,,(800) 356-1651,"Schmeler Extension, Elyseview, TAS, 61602",20001
Lowell,Gleason,,877.253.5216,"Mueller Heights, West Letitia, VIC, 394",20001
Kylee,Trantow,,844.344.6396,"Fidel Point, Hansenton, ACT, 67047",20004
Ephraim,Bins,,1-866-829-0525,"Osinski Place, Kshlerinport, VIC, 74147",20001
Cloyd,Pfeffer,,888.717.0423,"Lynch Way, New Anabel, WA, 81023",20005
Verona,Johns,,844.605.3079,"Huels Ford, West Mikelburgh, NSW, 80940",20003
Lia,Waters,,800.450.6846,"Erdman Springs, South Heidimouth, ACT, 65105",20007
Chanelle,Littel,,1-844-785-2298,"Streich Stream, South Geoffreyfort, TAS, 53576",20005
Electa,Paucek,,1-877-373-8789,"Davin Extension, Danialton, NT, 18765",20005
Vita,Kozey,,(866) 230-8468,"Aufderhar Loaf, East Elsie, NSW, 14913",20006
Dayana,Stanton,,855-280-5479,"Altenwerth Point, Alexaneside, VIC, 35308",20001
Emmet,Jacobs,,1-855-446-3827,"Rogahn Views, Port Erling, QLD, 48320",20006
Dell,O,,1-800-830-3064,"Macey Extensions, Mannshire, SA, 83476",20001
Janelle,Pagac,,855-969-0670,"Sanford Estates, Jaceystad, SA, 80039",20006
Terrill,Barton,,866.958.1864,"Zoila Island, North Payton, SA, 59091",20006
Leila,Beahan,,(877) 349-8567,"Mustafa Highway, New Roslynfort, VIC, 19865",20007
Donnell,Witting,,1-877-710-0909,"Devyn Via, Chynaland, NSW, 29058",20002
Maddison,Fadel,,866-954-4302,"Sandy Rapids, Daxborough, SA, 57145",20003
Korey,O,,800.580.2028,"Humberto Village, Borershire, ACT, 34687",20003
Alexzander,Zboncak,,(877) 770-5351,"Urban Brooks, Mertzland, TAS, 54601",20005
Daisha,Toy,,1-888-832-1770,"Abby Way, North Tannerchester, TAS, 75396",20006
Judah,Schuster,,888.519.7578,"Yoshiko Divide, West Aurelieview, ACT, 6369",20004
Stephan,Blick,,866.770.2252,"Elian Mission, Port Jasontown, NT, 80631",20002
Frederick,Thiel,,800-961-2192,"Grant Summit, North Wilfrid, NSW, 2869",20005
Krystina,Prosacco,,(800) 262-5070,"Langosh Flats, South Keonport, NT, 69229",20004
Oswaldo,Wehner,,(855) 378-4568,"Dicki Tunnel, Wizaborough, VIC, 78183",20003
Brenna,Lueilwitz,,1-877-507-8563,"Oscar Courts, Port Brandyside, TAS, 25419",20004
Amber,Paucek,,1-866-883-6743,"Fritsch Pike, Kosston, SA, 56309",20003
Marianna,Sauer,,844-239-2203,"Keira Grove, West Bria, SA, 46915",20007
Deontae,Lynch,,(877) 851-1353,"Lorenzo Station, Adahville, NT, 75576",20007
Hiram,Muller,,1-855-244-2311,"Bode Heights, West Chandlerbury, SA, 13335",20003
Sydni,Schultz,,877.869.5646,"Schmidt Overpass, Kesslerberg, WA, 22161",20004
Charlie,Krajcik,,888-973-2103,"Kuhic Coves, Lake Gabriellaport, NSW, 73535",20006
Kamille,Krajcik,,1-800-522-5346,"Brad Causeway, Jarrettmouth, ACT, 88971",20006
Gracie,Kassulke,,855.484.9109,"Osinski Plains, East Elenafurt, NSW, 56205",20001
Jaiden,Balistreri,,1-855-636-4035,"Zechariah Manors, South Marianeborough, VIC, 64639",20003
Augustus,Wilkinson,,877-233-1554,"Jerrold Neck, Otiliafurt, NT, 43152",20004
Arely,Tromp,,(888) 434-4552,"Ward Square, Dakotamouth, NT, 17002",20004
Aleen,Bauch,,1-877-693-0545,"Eli Tunnel, Reillybury, TAS, 64098",20004
Felicity,Wunsch,,888.759.3015,"Clair Burgs, Estellafurt, QLD, 7796",20001
Audra,Prosacco,,1-855-399-1657,"Reuben Hill, East Providencimouth, NT, 97285",20007
Jack,Mueller,,1-877-837-9294,"Callie Circle, Osvaldohaven, WA, 64159",20001
Ardella,Ebert,,888-488-8940,"Cheyenne Spring, Jacobsonside, NSW, 20623",20006
Eldridge,Purdy,,855-846-0440,"Henriette Via, Serenitychester, QLD, 51519",20002
Sheila,Oberbrunner,,800-690-1403,"Schimmel Fork, East Mattie, QLD, 63790",20003
Efrain,Watsica,,888-335-4845,"Nolan Club, East Savanahborough, QLD, 44709",20007
Saige,Parisian,,800-501-0525,"Garett Key, Walkerfort, TAS, 68234",20004
Turner,Gleichner,,1-866-424-5932,"Jakubowski Isle, West Rupert, NSW, 88773",20003
Marco,Feest,,866-779-9405,"Salvatore Creek, New Hertha, QLD, 34777",20002
Missouri,Fay,,(800) 374-4045,"Heathcote Rest, Ratketon, WA, 70073",20003
Alva,McGlynn,,1-866-615-5864,"Gay Ford, Hauckland, ACT, 78043",20006
Tre,Marquardt,,888-491-7194,"Leuschke Pine, South Camilla, SA, 28269",20005
Ernesto,Kuhlman,,877.600.0098,"Glover Haven, South Genesismouth, QLD, 35960",20004
Josiah,Lemke,,844.836.2607,"Abner Branch, West Sagemouth, SA, 52478",20002
Valerie,Haley,,1-877-202-2286,"Konopelski Shoal, Mistyburgh, ACT, 93504",20005
Rosalyn,McGlynn,,(800) 508-3536,"Devyn Fields, Hermanbury, ACT, 69979",20006
Emile,Walter,,800.209.1622,"Elsie Station, North Willowton, TAS, 43774",20002
Kareem,Erdman,,1-800-558-8017,"Rogahn Park, Strackeshire, VIC, 67600",20002
Maryse,Wisozk,,888.452.0929,"Botsford Manors, Lake Monserrateshire, NT, 40476",20005
Gage,Bergstrom,,(877) 360-2971,"Annetta Fort, East Noel, ACT, 66295",20003
Marilyne,Moore,,855-736-5066,"Hilpert Lodge, Aubreeville, ACT, 31153",20007
Victoria,Purdy,,(800) 480-4092,"Lorena Walks, Abrahammouth, TAS, 70046",20004
Eryn,Reichel,,(866) 832-7934,"Connelly Stravenue, Reichelhaven, WA, 19556",20005
Jalon,Lindgren,,877-884-2481,"Olson Corner, North Aliyah, ACT, 83202",20002
Zakary,Pfeffer,,(888) 933-6660,"Reichel Neck, Port Marta, NT, 19789",20002
Novella,Schuppe,,844.926.4148,"Fadel Shoals, Wernerville, WA, 15230",20002
Horace,Homenick,,888-309-6813,"O'Conner Loaf, West Norafort, WA, 99524",20003
Cleo,Jenkins,,1-877-215-6060,"Donavon Summit, O'Connellbury, WA, 25981",20001
Brandy,Padberg,,877.316.7621,"Margarett Park, Port Micaela, NSW, 60436",20007
Edwardo,Nicolas,,1-866-288-8035,"Assunta Valley, East Justonstad, NSW, 78928",20002
Jamie,Jakubowski,,800-253-9177,"Herman Track, Kundemouth, VIC, 26417",20005
Jamie,Schuppe,,(888) 550-6014,"Winnifred Mountains, South Grahamberg, WA, 68808",20002
Kelton,Berge,,855.888.2209,"Arlie Dale, Fatimaside, TAS, 53900",20002
Alfredo,Luettgen,,1-888-400-3072,"Claudie Tunnel, Aishashire, SA, 76525",20003
Beau,Erdman,,(866) 246-7136,"Lelah Vista, Johnsmouth, VIC, 72623",20001
Devonte,Gottlieb,,844.609.3690,"Larissa Greens, Beierton, VIC, 82564",20005
Kenny,Schuppe,,1-866-800-9458,"Watsica Crest, Sadyeland, TAS, 70326",20005
Francisco,Ondricka,,1-800-406-6177,"Maud Wells, New Rhettfort, TAS, 94003",20001
Cordell,Block,,(888) 666-5970,"Zulauf Points, Dollyview, NT, 21578",20004
Clement,Nolan,,844.696.4330,"Farrell Center, Kearaberg, SA, 8004",20006
Mireya,O,,866-751-3228,"Crist Mountain, East Bradley, VIC, 26379",20004
Myrl,Jacobson,,(800) 259-4928,"Ondricka Ranch, Port Gageside, QLD, 74623",20005
Nathanael,Keeling,,844-270-4278,"Greenfelder Drive, Port Jairoside, VIC, 62391",20001
Olaf,Kuhlman,,(888) 927-7059,"Bayer Row, East Clayport, TAS, 94531",20007
Tierra,Heaney,,877.765.4406,"Chanel Springs, North Maggie, NSW, 40672",20003
King,Marks,,1-866-740-8981,"Heaney Spurs, East Katlynberg, VIC, 28767",20003
Leonora,Ullrich,,877.344.5983,"Mohr Isle, North Herminio, NSW, 82751",20007
Domenica,Ortiz,,1-844-962-0847,"Daniel Valley, Reichertfort, WA, 38652",20005
Jerry,Upton,,(888) 343-1405,"Dibbert Hill, Walshfort, VIC, 73925",20002
Myrl,Leffler,,1-888-598-6516,"Flatley Crescent, Napoleonville, ACT, 43754",20007
Charles,Green,,(855) 938-1566,"Florine Mills, Domenickview, QLD, 68056",20001
Ethan,Adams,,800-894-0262,"Isadore Wells, Kshlerinville, NSW, 46534",20004
Claire,Cronin,,1-888-261-4892,"Therese Squares, North Maudland, NSW, 80915",20006
Leon,Hagenes,,800.480.3112,"Mariela Loop, Lake Madelynn, NT, 63447",20001
Alvis,Wiza,,855.344.7341,"Little Path, North Marianne, NSW, 19146",20006
Josue,Nikolaus,,866.837.2122,"Raphael Lights, Harrisport, VIC, 62096",20004
Derick,Mayer,,800.284.2206,"Hermann Causeway, Lake Veldamouth, ACT, 50742",20005
Ben,Goodwin,,877-481-4983,"Aron Valleys, Edgartown, NSW, 20399",20007
Jan,Sanford,,(844) 931-3328,"Turcotte Bridge, Port Zora, TAS, 60139",20007
Alex,Bayer,,888-410-2988,"Funk Extensions, Immanuelburgh, ACT, 82263",20005
Jairo,Kuvalis,,1-877-227-1143,"Emard Forges, Mayerstad, TAS, 74474",20003
Jeramie,Ratke,,1-888-537-4920,"Cleve Garden, O'Harastad, QLD, 71092",20002
Gwen,Weber,,855-314-2731,"Magnus Unions, Babyview, NSW, 36643",20007
Elwyn,Anderson,,(800) 842-6715,"Elwin Ranch, Kulasbury, WA, 62317",20006
Evan,Klein,,855-491-7037,"Grimes Roads, New Kyla, WA, 4278",20007
Isabel,Swift,,855.326.2876,"Lolita Ferry, Bettyport, SA, 25956",20006
Mittie,Zulauf,,877.726.2035,"Pfannerstill Inlet, Wunschmouth, TAS, 14116",20004
Edd,Stoltenberg,,1-844-533-6080,"Botsford Shore, Alyssonshire, ACT, 89223",20003
Daren,Paucek,,855.815.9972,"Josiah Coves, Bernhardmouth, NSW, 40257",20001
Modesto,Kreiger,,(844) 881-4912,"Brekke Club, Reynoldsland, VIC, 14707",20003
Sven,Gottlieb,,1-888-307-5948,"Edward Loaf, West Mavisborough, TAS, 9060",20002
Emmalee,Schaden,,844-313-7214,"Gleason Road, South Katelin, ACT, 95491",20006
Conor,Bartoletti,,877.724.8381,"Buckridge Forks, Lake Cletashire, QLD, 13090",20001
Micaela,Little,,(877) 770-3002,"Diana Bypass, Port Waylonchester, ACT, 22373",20007
Lorenzo,Klocko,,(888) 265-1431,"Farrell Port, Hackettshire, VIC, 93171",20002
Iliana,Ortiz,,1-888-605-9602,"Reggie Lodge, Davidborough, TAS, 79253",20004
Ned,Gorczany,,800.775.7350,"Lura Mountain, West Otilia, NT, 61676",20001
Chyna,Miller,,888-959-8297,"Lloyd Path, Shanahanborough, ACT, 58543",20004
Oren,Toy,,866.871.3334,"DuBuque Shores, Lake Adanborough, SA, 1021",20006
Lexie,Barrows,,844.772.4716,"Kulas Inlet, New Matteoshire, TAS, 22703",20001
Hazel,Langworth,,(877) 372-7753,"Mackenzie River, Franeckimouth, QLD, 72735",20006
Lelah,Armstrong,,800.539.9656,"Ubaldo Throughway, Felipaview, NT, 72582",20007
Leonie,Russel,,(855) 352-4744,"Terry Turnpike, North Karinamouth, WA, 85729",20007
Leanne,Schaefer,,888.892.1549,"Layla Glens, New Brooksfurt, WA, 30242",20003
Regan,Huels,,855.990.3730,"Brock Overpass, North Rebecca, TAS, 8702",20007
Cassandra,Bartoletti,,(844) 646-8715,"Kasey Station, Jacklynton, ACT, 919",20006
Angie,Muller,,1-800-631-5374,"Toy Mount, Mayachester, QLD, 16538",20001
Forest,Pagac,,1-855-273-1859,"Littel Heights, Trudiefort, SA, 20175",20003
Houston,Johns,,1-877-671-1232,"Felicia Parkway, Richiefurt, NSW, 33484",20002
Reba,VonRueden,,(866) 627-6053,"Harris Motorway, Osvaldoton, SA, 64746",20003
Audra,Lockman,,888-266-9406,"Borer Branch, Reichelside, ACT, 2981",20006
Tess,Herzog,,(844) 630-7544,"Dario Mills, Goldenchester, WA, 51563",20006
Alexandro,Purdy,,844.974.2047,"Rebecca Trace, East Glendabury, WA, 21773",20004
Vida,Hilpert,,877-592-5681,"Ally Fields, East Salvador, ACT, 77107",20004
Amie,Grady,,(877) 480-0471,"Reba Junctions, East Charity, QLD, 37775",20006
Chanelle,Nolan,,844.214.1616,"Justine Street, West Sonia, SA, 26768",20005
Allene,Cremin,,1-844-692-8267,"Rippin Extension, Schmidtshire, NSW, 88354",20006
Van,Leffler,,1-866-605-3096,"Beahan Groves, South Lamarburgh, QLD, 89185",20005
Roberta,Douglas,,800.666.2433,"Torp Throughway, New Anais, VIC, 39190",20002
Preston,Lehner,,866.898.3422,"Vandervort Prairie, Prohaskaborough, TAS, 65372",20006
Velma,Hammes,,1-877-616-0496,"Zemlak Rapids, South Ines, ACT, 6305",20007
Craig,Wintheiser,,866.360.2650,"Powlowski Streets, Lake Keyon, NSW, 59287",20002
Claude,Klein,,877-363-5077,"Shanon Point, South Penelopeberg, NSW, 1202",20003
Kim,Kemmer,,(800) 433-6171,"Crona Roads, Yoststad, NT, 96889",20001
Sophia,Johnston,,1-800-452-4482,"Edwin Pass, Christinetown, QLD, 91695",20003
Gayle,Gulgowski,,(888) 356-7645,"Ritchie Manors, Lake Americo, NSW, 40325",20001
Ernestina,Cartwright,,888-848-6349,"Mozelle Plaza, Masonland, VIC, 63046",20006
Abdullah,Bergstrom,,877-973-2138,"Michael Harbors, North Garfieldport, SA, 18187",20007
Gerard,Conn,,800.700.5008,"Dallin Canyon, Weissnatfurt, NT, 7323",20002
Samson,Nitzsche,,1-844-814-7333,"Volkman Union, West Katelynnport, VIC, 19640",20007
Birdie,Robel,,(866) 227-7552,"Ullrich Curve, Gennarochester, WA, 11266",20006
Beaulah,Dietrich,,866-296-4160,"Schinner Cove, Cruickshankmouth, QLD, 9632",20003
Amely,Sipes,,888-836-7217,"Green Canyon, New Trinity, NSW, 56343",20005
Cletus,Kozey,,888.707.1580,"Orville Brook, New Angelina, VIC, 84753",20004
Katrine,Stamm,,1-877-664-6044,"Dibbert Hollow, North Mckenziefort, ACT, 12087",20004
Kasey,Bednar,,844-980-0911,"Zora Springs, Feestville, TAS, 32289",20003
Winona,Schuster,,888.580.2392,"Zemlak Forge, West Christopherville, TAS, 8489",20005
Hope,Keeling,,1-866-842-6718,"Russel Pass, Port Nicholaus, SA, 40801",20002
Hyman,Stark,,855.961.4673,"Pfannerstill Coves, Port Maevemouth, ACT, 61522",20001
Marianna,Gibson,,844-688-0414,"Lang Divide, Serenityfort, SA, 83737",20007
Kaleb,Berge,,(800) 579-6545,"Zulauf Trace, Zitahaven, QLD, 4413",20006
Jewell,Gaylord,,800-213-3191,"Monserrate Glen, Emmerichberg, NT, 88852",20002
Deangelo,Friesen,,888.685.1580,"Kub Springs, Lake Vicenteborough, ACT, 66905",20004
Anika,Grant,,800-362-2953,"Denesik Via, Trudieberg, TAS, 57309",20004
Mathias,Stamm,,1-877-203-2442,"Carlo Estates, Port Pablo, VIC, 87152",20007
Katlynn,Gerlach,,(855) 913-2736,"Gutmann Islands, East Laurieport, NSW, 63351",20001
Melody,Keeling,,1-888-513-2215,"Ziemann Square, East Vincentstad, VIC, 38830",20005
Hulda,Jones,,866-202-3161,"Wuckert Shoals, New Shanyfort, WA, 67996",20001
Stephon,Leffler,,844.600.9935,"Mante Walk, East Myrtie, TAS, 17019",20003
Renee,Haley,,877-768-2495,"Schiller Drive, Port Fatimaborough, TAS, 90223",20002
Eve,Carter,,800-927-4364,"Carolina Port, Juliusfort, NT, 42421",20002
Eriberto,Beatty,,1-866-409-8726,"Lora Neck, West Lesleyfort, ACT, 76629",20004
Emery,VonRueden,,888.262.7558,"Dora Falls, Nicolasport, ACT, 73303",20002
Justus,Kertzmann,,(877) 414-7963,"Pattie Cove, South Laurelhaven, TAS, 49102",20007
Myron,Jenkins,,844.874.3071,"Eve Cove, Cassinstad, ACT, 59636",20007
Buddy,Cremin,,1-855-337-1293,"Amiya Stream, Lake Tylerstad, SA, 20220",20007
Marianna,Quigley,,888.820.1604,"Pouros Harbors, Morissettestad, ACT, 79403",20007
Eliza,McLaughlin,,(855) 728-1630,"Smitham Turnpike, Ricetown, QLD, 43107",20001
Arnaldo,Donnelly,,1-855-467-2040,"Roger Stream, Port Alyce, WA, 34282",20005
Priscilla,Daniel,,(888) 624-8384,"Dibbert Stravenue, Dickinsonfort, ACT, 43370",20006
Simone,Schamberger,,800-476-7617,"Kris Cove, Arielland, NSW, 31141",20005
Madalyn,Oberbrunner,,888-661-7628,"Jennings Glen, New Lonieland, TAS, 37844",20007
Ayana,Keebler,,(844) 847-9277,"Clotilde Ferry, Huelfort, QLD, 56600",20004
Ralph,Kilback,,(888) 663-2419,"Mueller Crossroad, Lauriannemouth, TAS, 67543",20005
Ernestine,Balistreri,,888-230-7314,"Emmy Tunnel, Tedhaven, NT, 49887",20003
Bertram,Bernhard,,800.735.1130,"Batz Mill, Port Sydney, WA, 89183",20006
Abelardo,Glover,,(844) 746-3448,"Aliza Walks, Conroyview, QLD, 52511",20006
Jasen,Ritchie,,(800) 671-3865,"Libby Parks, Port Adaline, QLD, 91894",20001
Russ,Hand,,877-502-1204,"Kovacek Crescent, Williamton, SA, 57056",20003
Charity,Heidenreich,,1-866-633-3986,"Beahan Camp, Rockymouth, VIC, 37002",20001
Electa,Nicolas,,(800) 252-9169,"Erich Park, Macview, QLD, 19867",20004
Christa,Casper,,1-866-846-3877,"Rhoda Knoll, Turnerville, VIC, 45834",20003
Thad,Sporer,,844.300.2991,"Herminio Ways, Dellaport, NT, 94311",20005
Zora,Schroeder,,877-203-3405,"Halie Isle, Alvertahaven, VIC, 79431",20005
Zoey,Prosacco,,(866) 973-4309,"Boyer Extension, Bridgettestad, TAS, 72140",20006
Brenda,Leuschke,,855-458-2000,"Gottlieb Path, Hermanstad, NSW, 40600",20003
Jerrold,Wilkinson,,1-888-808-4018,"Carley Prairie, Gibsonburgh, SA, 3202",20007
Kelley,Funk,,(855) 213-2557,"Zelda Roads, Brennaborough, WA, 670",20003
Kathlyn,Kerluke,,(844) 452-5828,"Botsford Estates, West Winfield, WA, 75397",20006
Percy,Wyman,,1-888-885-5392,"Dietrich Station, Port Lacy, VIC, 76987",20006
Shayna,Reichel,,(844) 540-2529,"Wilfrid Course, Kraigborough, NT, 18480",20006
Griffin,Goyette,,1-877-828-9809,"Casper Street, South Rubentown, ACT, 2401",20004
Otho,Hilpert,,(800) 298-1215,"Hickle Shores, Kaileeview, NSW, 11174",20001
Jayce,Monahan,,888.617.9255,"Maggio Ranch, Kiehnchester, SA, 85360",20005
Lane,Kautzer,,(888) 317-7943,"Smitham Ford, Gottliebville, SA, 36021",20005
Brenda,Gleason,,1-888-247-7805,"Lang Grove, Boehmmouth, WA, 33247",20002
Durward,Corwin,,(877) 868-3747,"Elijah Mall, Port Sherwoodside, QLD, 58125",20001
Layla,Lind,,888-479-3555,"Noemy Manors, East Ike, NT, 15707",20003
Marge,Hegmann,,844-900-7427,"Okuneva Shoals, Elsastad, ACT, 50836",20001
Jaeden,Mitchell,,1-888-205-1699,"Karianne Throughway, North Prince, TAS, 51103",20005
Ryan,Rice,,1-800-684-8777,"Hackett Forges, East Kieranstad, NSW, 75960",20003
Kathryne,Hackett,,1-888-607-3523,"Stamm Via, West Isidro, NT, 57381",20001
Delta,Pouros,,888-579-4255,"Kessler Fords, South Judge, QLD, 15205",20002
Troy,Murray,,888-514-6069,"Carter Motorway, Pacochamouth, VIC, 94399",20004
Rashad,Wiza,,(844) 592-1901,"Alysha Junction, Aufderharfurt, QLD, 88422",20005
Ulices,Jacobs,,1-888-339-2733,"Lemke Mission, West Emmittview, WA, 82686",20007
Cassie,Huels,,877-259-9715,"Bartoletti Station, Croninfurt, NT, 75176",20002
Beverly,Bosco,,1-844-732-5028,"Herman Coves, Kiarrastad, SA, 53075",20005
Lilyan,Rogahn,,844.747.6711,"Cathryn Cliff, Donatochester, ACT, 2033",20003
Fletcher,Ebert,,877.572.7673,"Boyle Harbor, Hickleland, VIC, 37644",20005
Santino,Schaden,,1-888-397-4275,"Daisha Common, New Rosalind, NT, 60474",20005
Mathilde,Ernser,,(888) 586-0226,"Valerie Keys, Lake Kaitlintown, VIC, 67446",20002
Damaris,Franecki,,844.334.9158,"Osinski Inlet, Schoenfort, QLD, 36592",20001
Dale,Emard,,800.457.1117,"Altenwerth Inlet, Erdmanchester, ACT, 46298",20001
Tod,O,,844.883.2840,"Emmet Way, Koepptown, TAS, 56916",20006
Allan,Jenkins,,1-866-591-4535,"Else Pines, Kuphalland, NSW, 47502",20003
Abelardo,Keeling,,800.418.8275,"Goldner Corners, Runolfssonmouth, NSW, 99065",20001
Chelsey,Hessel,,(844) 617-8705,"Sim Court, Cristalside, NSW, 11000",20002
Claudine,Bernhard,,1-800-513-8566,"Blanda Trafficway, East Evertstad, WA, 87378",20005
Edward,Oberbrunner,,866-626-4861,"Citlalli Dale, Kuphalville, NT, 87219",20005
Cordia,Spinka,,800-409-6556,"Rahsaan Hill, Marjolainemouth, WA, 66387",20001
Rosie,Dibbert,,877.464.1367,"Abbigail Summit, West Gonzalo, QLD, 42808",20005
Harry,Bartell,,(866) 248-8998,"Block Mill, Mooreview, NT, 39555",20003
Maeve,Ondricka,,800.799.6044,"Reina Vista, New Geovannybury, NT, 49147",20003
Lou,Hoppe,,844-887-6770,"Carter Underpass, Todborough, SA, 14644",20007
Daniela,Bailey,,(800) 271-2354,"Retta Oval, West Ettie, QLD, 13006",20002
Quincy,Hauck,,877.469.3866,"Hartmann Grove, Prohaskaside, ACT, 32781",20007
Brayan,Wolff,,(855) 357-3581,"Skiles Field, East Curt, QLD, 70779",20002
Itzel,Wilderman,,(877) 666-6465,"Joanny Dale, Lelandfurt, VIC, 27640",20001
Keagan,Senger,,844-413-4525,"Stehr Mountains, Volkmanborough, WA, 54298",20002
Jimmie,Nikolaus,,1-866-461-9710,"Schaefer Flats, Angeloville, SA, 4641",20003
Dasia,Hagenes,,1-855-444-6489,"Berge Mews, Darwinport, SA, 22257",20001
Kelvin,Metz,,888-597-9910,"Sedrick Radial, Emiliefort, TAS, 4626",20001
Chaim,Windler,,1-844-924-8126,"Sallie Throughway, Swiftburgh, VIC, 1166",20006
Frank,Gibson,,877-864-7680,"Nicolas Crescent, New Caraberg, VIC, 43852",20006
Justen,Upton,,1-888-306-8578,"Becker Route, North Cameron, TAS, 2678",20003
Citlalli,Grady,,800-274-3150,"Kuhlman Summit, Wolffmouth, VIC, 52272",20005
Alta,D,,1-800-612-3769,"Hassie Junction, New Randall, ACT, 83908",20003
Levi,Buckridge,,(800) 738-6502,"Champlin Forks, New Oswald, TAS, 91735",20001
Eryn,Shields,,866.387.8464,"Jermain Bridge, Waelchitown, SA, 24383",20005
Ericka,Bosco,,1-855-874-6964,"Gislason Freeway, Lake Mohammadberg, QLD, 8706",20002
Elinore,Wolf,,(800) 355-1718,"Jacobi Hill, Hesselmouth, SA, 9073",20007
Toby,Jones,,(866) 249-2134,"Leland Skyway, Miltonburgh, NSW, 47535",20004
Mertie,Von,,1-877-638-7647,"Domingo Ferry, Port Dominic, NSW, 19991",20006
Wilmer,Hettinger,,1-866-207-0933,"Barney Brook, Brionnaborough, ACT, 86388",20003
Emmanuelle,Fay,,(855) 857-7815,"Esta Loaf, Boehmmouth, QLD, 60713",20001
Mariela,Schuppe,,866.763.6471,"Audreanne Parks, Enriqueshire, WA, 84253",20003
Emilie,Kessler,,1-800-898-5294,"Laverne Fords, East Darientown, QLD, 48758",20002
Niko,Beier,,1-888-633-3583,"McDermott Plain, Yundtmouth, SA, 5413",20005
Macey,Hyatt,,855-928-1240,"Jakubowski Drives, Port Marilou, NSW, 53974",20001
