first_name,last_name,email_address,mobile_no,address,contact_owner_id
Daisy,Zemlak,,(800) 385-8043,"Felipa Camp, Donavontown, NSW, 84471",20001
Jaleel,Little,,1-844-506-7030,"Osborne Mountain, Briantown, VIC, 24737",20002
Aletha,Orn,,888.225.2438,"Kessler Divide, Borerhaven, NT, 81518",20002
Roberta,Tillman,,1-844-412-8820,"Goldner Stream, Laurentown, NSW, 10265",20007
Geraldine,King,,866-901-8210,"Nader Park, South Unahaven, NT, 26836",20001
Kimberly,Bogisich,,1-855-752-6309,"Orland Garden, South Lianaland, ACT, 12726",20001
Paige,Wiegand,,(888) 299-0183,"Logan Road, North Aleenfort, NSW, 65292",20001
