first_name,last_name,email_address,mobile_no,address,contact_owner_id
Daphnee,Strosin,,1-888-296-8824,"Johns Underpass, Woodrowfort, QLD, 65032",20007
Deontae,Balistreri,,1-855-949-1346,"Dare Court, Goyetteton, ACT, 77334",20006
Jaida,Kuhlman,,855.919.1086,"Kaya Summit, Clemmieburgh, WA, 14152",20003
Oswald,Labadie,,888-300-7315,"Shyann Orchard, Gerlachfort, NT, 57144",20007
Leilani,Lemke,,(844) 745-2886,"Crooks Turnpike, New Emmitt, SA, 72392",20002
Caleb,Johns,,1-800-734-5091,"Bartell Fords, West Austinville, WA, 53810",20004
Alvis,Hirthe,,1-855-218-0030,"Lucienne Parkways, New Brooks, QLD, 2193",20002
Delaney,Ratke,,866-671-9716,"Berge Club, Runteton, ACT, 59783",20003
Johnathan,Atapattu Liyanage,,(94) 6739 4889,"SL Rd, Bariston, NW, 23810",20007
Brayan,Trantow,,877.985.7873,"Andreanne Via, South Brando, ACT, 22431",20005
Juwan,Pfeffer,,(877) 903-2626,"Adams Canyon, Christelleport, SA, 31376",20007
Bobbie,Quigley,,800-559-2710,"Nitzsche Route, Altenwerthborough, VIC, 76699",20004
Glennie,Leffler,,866-859-4162,"Prudence Loaf, New Veda, VIC, 27862",20003
Morton,Ziemann,,800.266.8406,"Conn Stream, Willmsmouth, WA, 45166",20003
Carmella,Zieme,,1-855-313-0774,"Maggio Burgs, East Torrance, NSW, 57169",20006
Everette,Weissnat,,(844) 316-3920,"Dedrick Squares, East Brando, WA, 32313",20003
Anika,Mills,,877.333.3423,"Keyon Manors, Lilianeland, VIC, 73362",20006
Gerardo,Wilderman,,855-248-2042,"Torphy Square, Lake Carymouth, NT, 12774",20002
Kamla,Janith Hapugolla,,(94) 1237 2131,"New Street, Josmithyas, NT, 23810",20004
Reuben,Becker,,(888) 852-8092,"Mozell Shores, Wardside, VIC, 95535",20004
Bettie,Funk,,1-888-828-2584,"Alessandra Course, Hintzside, ACT, 73142",20004
Edwin,Zieme,,1-800-392-2022,"Selina Run, Marilynemouth, NSW, 28297",20005
Nikita,Kunde,,1-877-642-2783,"Beier Branch, New Sherwoodtown, VIC, 51225",20004
Carmel,Jaskolski,,(888) 876-2310,"Jaycee Port, Audreystad, SA, 54371",20007
Antone,Mertz,,(877) 958-4635,"Spencer Circle, Juniorhaven, TAS, 47568",20004
Selmer,Mohr,,800.616.8507,"Turner Avenue, Heathcotemouth, ACT, 73797",20003
Karelle,Mayer,,855.963.0203,"Stracke Trail, Whiteberg, VIC, 2285",20003
Nikko,Schmeler,,1-866-817-3305,"O'Conner Crest, Joneshaven, TAS, 3590",20007
Omari,Wunsch,,(855) 683-9930,"Casey Mountain, Torranceburgh, NT, 73920",20001
Brenna,Kling,,800-695-6501,"Johns Mill, Milliefurt, VIC, 60100",20007
Timmy,Medhurst,,866-822-8022,"Nicholaus Mission, O'Keefeland, SA, 65576",20007
Nils,O,,(888) 510-3005,"Botsford Parkways, Port Carliville, NT, 69588",20004
Garth,Rice,,800.708.0474,"Dach Vista, West Noeliaville, TAS, 258",20003
Talia,Grimes,,1-888-254-2803,"Rempel Grove, New Deonberg, QLD, 94900",20007
Hilario,Stanton,,888.412.2799,"Gutkowski Stravenue, Paucekmouth, NSW, 4245",20007
Orville,Nikolaus,,844.415.0067,"April Mountains, Brandtview, QLD, 91109",20007
Libby,Hartmann,,844.630.9657,"Rae Street, South Ian, VIC, 27106",20007
Gus,Wiza,,855.363.9403,"Isaac Alley, North Oscarfort, WA, 21967",20002
Dylan,Legros,,1-888-312-9599,"Logan Turnpike, New Bart, ACT, 93546",20001
Maximillian,Pfeffer,,1-800-287-7830,"Mante Summit, Carolyneburgh, ACT, 13079",20001
Aglae,Jacobs,,844-491-8006,"Wunsch Gardens, Kaneport, QLD, 56185",20004
Jackson,Bartell,,888.978.4701,"Cielo Extension, Edytheton, NT, 43173",20006
Gabriella,Baumbach,,(877) 893-8836,"Schiller Trafficway, Labadieview, QLD, 8111",20004
Clara,Bogan,,855.933.6329,"Thompson Parks, Ornside, VIC, 30469",20006
Fae,Schamberger,,1-877-648-6322,"Forrest Village, New Hollie, TAS, 25996",20006
Columbus,Wuckert,,(888) 560-9893,"Satterfield Street, East Susanaland, TAS, 93716",20006
Jameson,Hudson,,(888) 783-2292,"Hegmann Flats, North Angelica, ACT, 83485",20003
Kenneth,Durgan,,1-877-237-6946,"Anjali Lane, East Stephanborough, TAS, 49973",20006
Leatha,Spinka,,877.294.4859,"Norbert Creek, West Violabury, SA, 71729",20002
Danielle,Lind,,888-942-8869,"Benton Squares, Winnifredfurt, WA, 61847",20005
Paul,Murphy,,(800) 826-7767,"Edison Burgs, Maynardbury, VIC, 79307",20006
Felipe,Kuhn,,844-613-6524,"Stark Circle, Krajcikton, SA, 21845",20001
Claudia,Conn,,800.319.6139,"Murphy Key, North Benniehaven, NT, 3014",20001
Bettie,Runolfsson,,855.316.2894,"Stracke Green, South Malachi, VIC, 2656",20007
Brice,Mitchell,,1-877-926-3044,"Simonis Greens, Tremblayhaven, VIC, 59316",20002
Lonie,Hackett,,(855) 708-3687,"Kamren Ridge, Gusikowskiville, VIC, 81510",20003
Johnathan,Lindgren,,1-866-703-9776,"Walsh Flats, Baileyberg, ACT, 26498",20002
Alycia,Wehner,,(888) 913-1641,"Moen Roads, Lake Ima, VIC, 26300",20004
Jakayla,Robel,,800.790.9335,"Heathcote Plaza, East Kieran, SA, 50629",20007
Melissa,Green,,866-404-2551,"Okuneva Loop, Lake Madalinemouth, SA, 9843",20005
Bill,Gottlieb,,1-866-360-2439,"Hodkiewicz Glens, East Griffinchester, TAS, 87242",20005
Aliyah,Hartmann,,(877) 854-4788,"Martina Mission, DuBuqueborough, WA, 67353",20001
Santa,Schowalter,,(844) 707-1754,"Saul Pines, Nestorton, TAS, 96557",20005
Aniyah,Mohr,,(888) 409-1315,"White Lights, East Aliyatown, QLD, 15385",20005
Howard,Aufderhar,,888.917.2415,"Luettgen Crest, New Joannie, QLD, 83729",20002
Gilbert,Koelpin,,877.810.5042,"Macejkovic Views, Hertaburgh, NSW, 49946",20007
Emely,Hessel,,1-800-994-1610,"Walter Freeway, Carlottafort, TAS, 57822",20005
Adrien,Swift,,866.645.0442,"Dorothea Shoal, Mertzside, WA, 74163",20002
Dustin,Larkin,,1-877-463-9177,"Hodkiewicz Forges, Grimesport, QLD, 42860",20001
Creola,Mraz,,877.812.6394,"Friesen Shoals, Bauchfort, NT, 59333",20001
Warren,Gleason,,800-327-7045,"Towne Tunnel, East Haylee, WA, 92192",20004
Benton,Roberts,,1-844-393-8627,"Moen Flat, Terrillberg, QLD, 51821",20005
Kennedy,Durgan,,1-800-367-3462,"Leuschke Cape, Lake Brianne, NT, 83498",20005
Trent,Spinka,,1-877-740-0839,"Carli Center, Juneside, NT, 63604",20003
Rick,Cremin,,855.674.0458,"Cummerata Spur, Lake Johnniestad, SA, 63586",20001
Jaylen,Legros,,800-243-1399,"Alex Crest, Champlinfort, NSW, 82454",20003
Syble,Koelpin,,800.531.1425,"Collin Glens, East Arnaldoborough, QLD, 85256",20004
Antwon,Fadel,,800.556.3611,"Spinka Track, North Hesterhaven, NSW, 23726",20002
Adonis,Pouros,,888.771.8327,"Alessia Alley, North Pietro, ACT, 68029",20003
Lorenz,Schultz,,866.733.9628,"Ellsworth Mission, North Chelseatown, VIC, 50797",20007
Jolie,Nikolaus,,866-225-4216,"Shyanne Loaf, East Delmerland, WA, 41374",20005
Zakary,Hettinger,,(877) 573-4569,"Medhurst Parks, Franeckichester, NSW, 34452",20003
Letha,Stehr,,(855) 298-2057,"Eladio Mountains, New Adela, SA, 69157",20004
Ara,Cormier,,(866) 873-4910,"Adrianna Manor, Mikelmouth, NSW, 63303",20007
D'angelo,D'angelo,,1-877-204-5045,"Cale Place, Port Tate, ACT, 45218",20005
Mara,Turner,,877-465-8149,"Dicki Prairie, West Osbaldo, WA, 60396",20002
Amiya,Sanford,,1-866-766-8817,"Roberts Pass, East Friedrich, ACT, 18252",20001
Bailee,Harris,,1-855-691-2347,"Melvin Port, New Anselfurt, WA, 46755",20005
Kellie,Schuppe,,(855) 375-6880,"Schoen Spur, Einarview, ACT, 44109",20003
Augusta,Murphy,,1-844-735-2875,"Jaeden Roads, Aureliomouth, ACT, 17784",20004
Myles,Kiehn,,1-888-460-3119,"Sofia Cape, Altenwerthport, NSW, 13020",20004
Junius,Gleichner,,800.413.8293,"Jast Trail, Shaniyamouth, WA, 54771",20006
Asha,Johnston,,1-877-991-6712,"Rodriguez Meadow, North Aishafurt, WA, 31362",20007
Gregg,Balistreri,,(877) 391-5814,"Oberbrunner Isle, Faheychester, WA, 65377",20007
Verona,Miller,,1-866-626-9420,"Kuhic Club, Boganhaven, VIC, 94137",20006
Louie,Berge,,844.821.5233,"D'Amore Wall, New Irmaburgh, QLD, 31246",20004
Rodger,Crist,,855.445.1040,"Euna Lane, Port Zulaberg, NT, 53985",20001
Helene,Hirthe,,877-367-9310,"Emmerich Plaza, Tretown, QLD, 63745",20006
Cornell,Bruen,,1-800-757-4372,"Glenda Mills, Port Jolietown, NSW, 81822",20007
Stevie,Rogahn,,(855) 271-7303,"Edmond Street, Quigleyville, SA, 5372",20001
Rosalee,D,,1-855-731-2418,"Daphne Neck, Lake Etha, QLD, 7146",20002
Kelly,Robel,,1-877-803-2430,"Williamson Inlet, Molliebury, NT, 8264",20001
Reanna,Lind,,866-812-2555,"Waylon Passage, Lake Claudie, WA, 95041",20004
Logan,Borer,,1-855-755-6544,"Naomi Square, South Shanie, SA, 56931",20003
Wilfrid,Lemke,,844.350.1164,"Witting Village, North Lora, SA, 41349",20001
Danielle,Kuhn,,877.235.2651,"Walter Village, Hagenesburgh, TAS, 13075",20005
Mara,Paucek,,1-855-361-9239,"Mathias Circle, Lakinville, SA, 91513",20006
Otilia,Ondricka,,855.337.8616,"Pascale Orchard, Port Adonis, NT, 5888",20004
Vicenta,Schmitt,,800.569.0624,"Jaylan Street, Pagacville, SA, 37967",20004
Karolann,Koss,,1-888-825-2100,"Lavern Bridge, South Alysonmouth, TAS, 77292",20006
Narciso,Yost,,(888) 491-0850,"Doyle Rapid, Beahanmouth, QLD, 80301",20003
Zola,Zemlak,,1-844-359-5057,"Veum Skyway, West Justus, TAS, 19701",20003
Dewayne,Will,,866.481.0066,"Samir Vista, New Richiehaven, SA, 6162",20004
Myrna,Pagac,,855.246.5452,"Adella Mount, West Weldonville, WA, 19940",20006
Zoila,Pollich Jayasumana,,(844) 766-4682,"Judy Turnpike, Savanahchester, TAS, 80516",20005
Reid,Pollich,,1-877-380-1826,"Langosh Summit, North Samaraberg, SA, 9119",20003
Shayna,Kemmer,,1-877-665-3499,"O'Conner Mills, Alyciabury, TAS, 65655",20006
Brock,Moen,,877.998.8529,"Bogan Rest, Clementinaville, VIC, 48220",20001
Lura,Lebsack,,866-361-7973,"Huel Freeway, Sengerhaven, ACT, 11859",20007
Ned,Vandervort,,(844) 476-7422,"Reece Ridges, Millerhaven, SA, 57356",20002
Elda,Farrell,,1-844-313-6486,"Haley Pike, Stantonport, WA, 84378",20006
Nannie,Nitzsche,,(866) 875-3404,"Shawna Union, Antonetteport, TAS, 98416",20003
Jaime,Hessel,,844-786-8944,"Schulist Row, Lavernaberg, SA, 16183",20004
Francesca,Koss,,1-800-498-9674,"Von Harbor, North Jane, TAS, 903",20002
Paige,Bernhard,,(800) 939-9939,"Kianna Island, Luciuston, TAS, 51195",20004
Marcelina,Shanahan,,(800) 458-1568,"Lamar Extension, Turcottetown, NSW, 68344",20006
Helmer,O,,855.662.7724,"Weber Mountains, Cleohaven, TAS, 93125",20005
Toy,Goodwin,,855-980-2172,"Funk Walk, West Teresastad, NT, 44055",20001
Sylvan,Pollich,,855-889-7772,"Kamille Overpass, Hintzside, QLD, 75154",20002
German,Fritsch,,855-304-8232,"Grimes Mission, Denesikport, SA, 83206",20005
Perry,Greenholt,,866-865-3154,"Nicolas Brooks, Bartellbury, TAS, 45956",20005
Jess,Hackett,,(866) 276-5315,"Thiel Roads, East Dorotheaberg, VIC, 45367",20003
Annabel,Schroeder,,(800) 544-1141,"Aurore Mountains, Violettemouth, VIC, 6061",20003
Eloise,Becker,,866-915-6292,"Turcotte Plains, East Marcelbury, NT, 99890",20002
Maxwell,Monahan,,(800) 464-0326,"Candido Radial, North Josefina, SA, 78561",20001
Concepcion,Volkman,,888.595.2061,"Agustina Streets, Harveyberg, VIC, 48910",20003
Luz,Hamill,,855.767.6383,"Chyna Vista, Port Lina, SA, 32557",20003
Kareem,McGlynn,,866-788-4847,"Rosemarie Path, Ryanborough, WA, 47528",20004
Monte,Zemlak,,888.653.3218,"Tevin Corner, Jailynchester, NT, 5709",20002
Kayli,Flatley,,800-827-8079,"Turcotte Gardens, Lake Woodrowside, ACT, 68059",20001
Brant,Renner,,888-381-1742,"Mann Crescent, Lake Adah, ACT, 81085",20001
Kayla,Metz,,1-855-869-2390,"Predovic View, Port Jalenton, TAS, 43236",20004
Alycia,Crooks,,(866) 971-2826,"Avis River, Luettgenview, QLD, 61157",20001
Buster,Huels,,(877) 780-8526,"Bashirian Parkways, Lake Dameon, SA, 79759",20006
Kennedy,Herzog,,1-855-382-2065,"Grimes Ville, Maximillianton, ACT, 25809",20005
Agnes,Raynor,,1-844-426-5253,"Muller Key, Port Katharina, ACT, 26707",20002
Arnaldo,Vandervort,,877.642.5043,"Becker Causeway, Maybelleberg, TAS, 62905",20005
Macy,Stokes,,1-877-695-4074,"Schmidt Center, East Faye, ACT, 60129",20006
Eldora,Kiehn,,(844) 293-6976,"Hamill Vista, Quigleyborough, WA, 98940",20002
Joelle,Marvin,,855.462.4136,"Luther Walks, Lake Nya, TAS, 93284",20005
Jayme,Quigley,,1-888-745-6538,"Charlie Shore, Hermanntown, NT, 59180",20002
Nicolette,Simonis Rasaduna,,(800) 291-7813,"Lydia Plaza, Gianniburgh, SA, 84096",20007
Providenci,Marquardt,,866.437.0292,"Lind Meadow, Lake Reese, SA, 60748",20006
Bonita,O,,888.532.7300,"Gottlieb Motorway, Jakubowskihaven, NT, 4864",20001
Adela,Green,,(855) 642-7227,"Tianna Mountains, Port Margretview, QLD, 20364",20004
Holden,Keeling,,(877) 603-4059,"Newell Ports, South Martinaburgh, VIC, 92985",20006
Kacey,O,,844.464.5403,"Maya Loaf, Okunevamouth, TAS, 16286",20006
Lavinia,Ruecker,,(844) 918-6237,"Emmett Crossing, Port Joannie, QLD, 62644",20007
Kayden,Kessler,,1-866-432-2672,"Clemens Falls, Janiyaside, NSW, 68961",20001
Mollie,Gerlach,,800.960.5805,"Funk Route, North Dorthymouth, VIC, 30470",20002
Maegan,Strosin,,(866) 304-6765,"O'Hara Circle, Fritschport, VIC, 20906",20004
Pascale,Dietrich,,(800) 484-5798,"Deshaun Falls, Madisenmouth, QLD, 95574",20004
Annabelle,Gislason,,844-751-4668,"Dora Dale, Masonmouth, TAS, 91319",20003
Donna,Franecki,,877.273.0303,"Ondricka Village, Eleonoreburgh, WA, 35378",20001
Lea,Herman,,1-844-996-4638,"Jast Circle, Considinechester, ACT, 86315",20004
Colten,Monahan,,(877) 226-9776,"Benedict Burg, North Camrenfort, NT, 476",20007
Christelle,Gibson,,855.223.8569,"Bernier Village, Gerholdshire, WA, 94504",20007
Pasquale,Fay,,888-444-2062,"Bernadine Village, North Nicola, NT, 86441",20007
Kacie,Stiedemann,,855-528-0788,"Camila Trail, Tatumfurt, VIC, 44219",20006
Alexander,Streich,,800-229-0389,"Marquardt Turnpike, Lake Asia, SA, 20142",20005
German,Roberts,,1-855-613-4863,"Lionel Motorway, Balistrerishire, VIC, 46264",20004
Noemy,Osinski,,1-855-805-6576,"Ankunding Crescent, New Fabianfurt, ACT, 54999",20001
Reina,Macejkovic,,800-243-0672,"Carlie Locks, South Jeffreyburgh, NT, 93313",20001
Mauricio,Eichmann,,866.736.3304,"Towne Drives, South Earlland, QLD, 72006",20005
Everette,Schaden,,1-800-882-0053,"Collins Streets, Lake Nicolasfurt, TAS, 70037",20002
Iva,Abernathy,,(866) 764-0503,"Durgan View, New Benedictbury, WA, 28752",20002
Rosa,Ankunding,,888.623.2763,"Araceli View, Sporertown, WA, 82132",20007
Carlee,Gerhold,,1-844-710-8017,"Heller Inlet, Watsicaton, WA, 18049",20006
Otho,Stamm,,855-438-4503,"Nico Forest, North Mohammadchester, QLD, 63118",20001
Tiffany,Morar,,866-528-7764,"Rempel Shore, South Reynoldborough, TAS, 82002",20003
Alisha,Deckow,,877-348-6018,"Feest Summit, Darronfort, QLD, 20548",20005
Jamel,Roberts,,855-226-6233,"Farrell Knoll, Kertzmannton, ACT, 34765",20001
Darien,Krajcik,,1-888-261-1810,"Cassidy Burgs, Sydneefort, TAS, 72799",20006
Quinten,Towne,,844-500-3072,"Reilly Lakes, Port Darbyport, NSW, 2035",20007
Kailey,Wehner,,1-866-203-8782,"Mills Squares, Lake Demarco, NT, 33140",20004
Hobart,Lindgren,,1-844-798-8651,"Greenholt Glen, Hegmanntown, SA, 95527",20001
Domenic,Armstrong,,855-958-4308,"Skiles Ferry, New Stephanfurt, ACT, 26176",20001
Zetta,Thompson,,(800) 725-5745,"Arnoldo Orchard, Port Devonshire, ACT, 12375",20007
Mabel,Anderson,,888-963-0211,"Faye Isle, East Haleigh, QLD, 48616",20003
Rupert,Mante,,855-706-7637,"Jamel Valley, West Madalynchester, WA, 25065",20006
Josie,Yundt,,1-866-772-8756,"Barrows Unions, Aliaborough, ACT, 68673",20003
Lura,Nader,,800-993-6773,"Jenifer Squares, Dietrichburgh, QLD, 23832",20004
Tyler,Daugherty,,1-866-373-1132,"Kertzmann Islands, Icieberg, ACT, 61992",20005
Tyson,Weissnat,,855-482-9702,"Jonatan Island, New Cadeport, TAS, 56253",20006
Flo,Smith,,(877) 403-8926,"Kuhlman Hills, Norabury, SA, 59821",20005
Enrique,Daniel,,1-866-436-4535,"Marianne Land, Ralphview, SA, 9556",20004
Randal,Hansen,,(855) 912-5069,"Metz Mountain, New Delta, VIC, 10809",20006
Adrian,Quitzon,,855-647-3552,"Chester Fields, Vinniebury, QLD, 17823",20005
Korey,Balistreri,,844-728-5117,"Mosciski Forks, Blickmouth, WA, 44011",20003
Jack,Bailey,,866.926.9032,"Denesik Ford, Mohrville, NT, 32641",20007
Kayla,Luettgen,,866-445-3858,"Rutherford Common, Lake Rogers, SA, 34134",20006
Eldridge,Barton,,877-359-8747,"Schmidt Gardens, Port Isaiahshire, TAS, 61010",20003
Royal,Osinski,,(800) 677-8573,"Rashawn Islands, New Mattie, TAS, 93236",20004
Jaden,Mante,,(844) 961-4358,"Hazle Vista, Stefanietown, NSW, 97748",20005
Melyna,Aufderhar,,844-678-2434,"Koss Parks, Leliaville, NSW, 97075",20002
Willow,Blanda,,1-855-408-4642,"Bergnaum Viaduct, Jakubowskiborough, SA, 31759",20002
Wanda,Schoen,,1-877-849-5767,"Greenholt Place, Port Griffin, WA, 69758",20006
Jewel,Lang,,1-877-549-1915,"Price Forge, Reichelberg, WA, 74257",20002
Delbert,Schmeler,,844.519.9564,"Curtis Via, Conroyport, NSW, 45374",20002
Milo,Bogisich,,877.418.7676,"Briana Walk, Fannymouth, ACT, 44481",20004
Kayden,Berge,,(888) 776-2537,"Tatum Glens, Cartwrightborough, VIC, 5345",20006
Zetta,Hilpert,,844.302.2962,"Cleta Forges, East Trey, QLD, 20806",20006
Elliott,Schiller,,1-888-871-5089,"Lynn Viaduct, West Leopoldo, VIC, 74740",20002
Jakayla,Grimes,,888-228-5540,"Madyson Highway, Port Kaitlin, TAS, 13972",20003
Noemy,Hintz,,844.506.6261,"Mack Groves, Bradtkeberg, SA, 75113",20004
Toney,Langosh,,800-533-1715,"Quigley Stream, North Maiya, SA, 59772",20007
Alexandre,Wisoky,,888-894-0557,"Emilio Skyway, Maximeside, SA, 98941",20007
Imani,Kuhn,,1-855-297-7337,"Greenfelder Inlet, New Jarvis, TAS, 94900",20003
Cory,Cummings,,(866) 747-3132,"Crona Avenue, Fernandoport, VIC, 83904",20004
Laron,Grant,,(800) 666-1913,"Stark Falls, Russelmouth, NSW, 49819",20005
Anastasia,Kemmer,,1-844-990-1139,"Hammes Spurs, Ransomburgh, VIC, 25642",20005
Darryl,Skiles,,855.576.8419,"Erdman Shores, South Claudberg, NT, 64647",20003
Laron,Jakubowski,,855-680-2565,"Cindy Plain, Alexfurt, WA, 18599",20003
Margaret,Deckow,,1-855-537-6283,"Reichel Viaduct, Ansleyton, QLD, 57163",20002
Gennaro,Rogahn,,855-220-8688,"Ellis Port, East Dedrick, SA, 90222",20001
Alysa,Welch,,844.574.9721,"Concepcion Fort, Kutchfurt, ACT, 28660",20005
Julianne,Ernser,,1-855-208-4055,"Kemmer Circles, Jedidiahhaven, NT, 52539",20004
Hilma,Aufderhar,,(877) 546-0828,"Jovan Overpass, South Janice, SA, 87320",20007
Akeem,Hintz,,877.385.3004,"Darrion Underpass, Port Hollis, NT, 2641",20006
Roel,Kunze,,(855) 217-8975,"Cole Walk, West Emmett, QLD, 95993",20002
Oma,Willms,,888-581-5350,"Virginia Row, Kozeyton, ACT, 37642",20005
Maverick,Feeney,,877-587-4206,"Nayeli Cape, Beulahtown, WA, 7404",20005
Paige,Kassulke,,(855) 888-3342,"Goodwin Flats, North Raina, ACT, 55023",20006
Savion,Powlowski,,(844) 579-7851,"Melyna Trace, Johnsbury, ACT, 98262",20006
Jena,Beier,,877.399.9604,"Elmo Valley, North Parkerview, NT, 4406",20004
Kiarra,West,,1-800-584-0092,"Bell Dale, New Aurelia, TAS, 41202",20004
Harrison,Heller,,888-983-5910,"Heidenreich Corners, Streichview, VIC, 30847",20007
Alba,Gusikowski,,888.489.5310,"Katarina Ridges, Wittingville, NT, 47480",20007
Randy,Corwin,,888-200-2274,"Adelle Skyway, New Lindsayton, NSW, 30066",20005
Winston,Ebert,,800.504.6286,"Myah Prairie, Wardchester, TAS, 28205",20005
Harmony,Zboncak,,1-800-809-6895,"Price Field, Port Julie, NSW, 96573",20001
Luis,DuBuque,,(844) 628-3648,"Bertrand Cliff, Port Brodyberg, QLD, 14432",20001
Garry,Rau,,1-800-220-3548,"Rick Trail, Patriciamouth, QLD, 44947",20007
Raphael,Russel,,(844) 792-9195,"Stoltenberg Square, Grantshire, NSW, 21781",20003
Halle,Sawayn,,1-844-788-5481,"Lind Cliffs, Wunschbury, ACT, 44302",20001
Zula,Tillman,,1-877-783-8922,"Schmidt Glens, Javierburgh, NT, 90570",20005
Madisyn,Volkman,,(866) 626-0231,"Gino Isle, East Casimer, VIC, 76143",20002
Myrl,Reinger,,1-877-368-3981,"Kianna Pike, Loweland, TAS, 23250",20004
Candice,Rosenbaum,,1-855-557-3523,"Reyna Street, South Celestinotown, SA, 7731",20001
Deondre,Brown,,(844) 524-7996,"Cindy Bridge, Lockmanshire, TAS, 86271",20004
Matilde,Leuschke,,(888) 792-5090,"Nadia Walk, South Donnatown, TAS, 75833",20006
Guadalupe,Oberbrunner,,866-854-7540,"Carroll Ways, Krisshire, SA, 95315",20001
Fannie,Klein,,(888) 728-7257,"Luther Crossing, North Chesleyfort, VIC, 90173",20002
Tressie,Durgan,,(800) 474-5891,"Elmira Roads, Isaiahshire, SA, 73080",20004
Dina,Purdy,,855-526-8067,"Lockman Square, Shanieville, SA, 4477",20006
Arianna,Koss,,855.306.0565,"Marquise Lodge, Gorczanyport, TAS, 30300",20004
Valentine,Hagenes,,844-506-4954,"Morissette Hollow, Strackeview, NT, 77248",20004
Rudy,Kutch,,1-866-652-0302,"Rohan Parkway, Darrionview, TAS, 92529",20004
Reba,Rath,,1-877-863-4514,"Hoeger Springs, New Carmellaview, TAS, 42498",20005
Maximilian,Walsh,,855-751-2866,"Linwood Freeway, Port Ignaciobury, NSW, 64301",20002
Hermina,Miller,,(844) 714-9995,"Roxanne Crescent, New Carolyne, QLD, 30007",20005
Genoveva,White,,855.941.2720,"Duncan Run, West Ova, QLD, 34310",20005
Hank,Lynch,,1-866-614-6639,"Manuel Rapid, South Robertaland, SA, 7809",20006
Deondre,Robel,,855.779.3762,"Murray Mews, Geraldland, NSW, 96914",20003
Mafalda,Yundt,,888-607-3624,"Pietro Isle, New Cleveland, SA, 50072",20007
Westley,Mann,,844.921.9382,"Jones Branch, West Gonzalo, QLD, 83194",20006
Josefina,Schuster,,(844) 995-6771,"Ava Ridges, Fadelside, VIC, 71773",20005
Darian,Jerde,,(800) 612-5637,"Kreiger Street, Lake Maudfurt, TAS, 44664",20003
Faustino,Swift,,844.709.9115,"Devan Locks, Koeppburgh, NT, 56926",20007
Trevion,Predovic,,(888) 938-2678,"Alvena Lane, Port Moriah, WA, 12699",20003
Allen,Hauck,,1-844-590-4287,"Mae Harbor, North Carmella, QLD, 61068",20003
Emilia,Heidenreich,,888.766.6622,"Fay Lane, East Gerard, QLD, 21862",20006
Elna,Streich,,1-844-827-2896,"Cornell Mission, Domenickberg, TAS, 50718",20005
Drew,Beatty,,(855) 422-1805,"Welch Mountains, Deltaton, NT, 79230",20007
Clare,Aufderhar,,866.515.5079,"O'Conner Mountain, South Bailee, ACT, 57456",20001
Rosalind,Brakus,,877.637.7052,"Amaya Parks, Port Niko, ACT, 78846",20001
Hugh,Mante,,855-368-9475,"Kayden Shoals, Harrisshire, WA, 71116",20007
Norval,Baumbach,,(844) 839-8230,"Crystal Mountains, North Melyssa, VIC, 35001",20003
Heaven,Harris,,(855) 395-4766,"Fiona Island, North Makaylamouth, NSW, 82457",20006
Webster,Stokes,,(855) 413-8547,"Glover Wells, Casperside, SA, 67766",20007
Aric,McClure,,844.962.2448,"Neha Stravenue, North Gay, NSW, 75138",20001
George,Robel,,877-291-0902,"Verna Mountain, New Francescahaven, VIC, 74254",20005
Reed,Deckow,,(844) 970-2055,"Lehner Crossroad, West Providenciberg, WA, 4251",20004
Paige,Bauch,,877-578-2636,"Saul Ports, Lake Tiffany, VIC, 84117",20002
Dallin,Cormier,,(800) 626-4627,"Augustus Common, Lake Naomie, SA, 77923",20001
June,Heaney,,855-480-5330,"Rosanna Green, West Jeanette, VIC, 99885",20003
Era,Waters,,855-750-5086,"Tremayne Extensions, West Aaronville, NSW, 66185",20003
Lauren,Murazik,,1-844-968-3943,"Crist Glens, North Arnulfo, ACT, 4336",20007
Buford,O,,(866) 742-6340,"Laisha Street, North Adrielstad, SA, 44841",20006
Laisha,Yost,,844-492-3602,"Kozey Gardens, Conniechester, NSW, 94852",20002
Cathryn,Rowe,,1-844-441-5205,"Sofia Orchard, West Jerodview, NT, 43936",20001
Erin,Gislason,,855-750-3733,"Kareem Alley, Wittingberg, WA, 53949",20005
Collin,Ritchie,,1-877-508-6375,"Joel Groves, Leonormouth, VIC, 47528",20005
Constantin,Stroman,,888.296.6453,"Lydia Station, South Irvinghaven, ACT, 85230",20006
Julianne,Parisian,,1-888-297-9020,"Daron Crossroad, Darrylfurt, ACT, 57104",20003
Aryanna,Dach,,844.780.8769,"Harris Key, Lake Otto, WA, 74931",20005
Darrell,King,,877-625-0537,"Bernier Center, Lake Susie, ACT, 17066",20004
Ali,Rice,,1-888-639-5605,"Diamond Prairie, New Coletown, ACT, 62960",20006
Elvis,Walsh,,844-633-4136,"Kyla Path, South Angelinaville, TAS, 51851",20002
Asa,Zieme,,844.393.0532,"Conroy Island, South Judson, NT, 22797",20002
Vicky,Gutmann,,800-944-6588,"Rau Pass, Abernathyborough, SA, 4722",20004
Zula,Quitzon,,1-844-891-4727,"Rylee Pass, Rhodastad, WA, 82866",20006
Laverna,Bailey,,844-931-0197,"Darrin Crossing, Lake Janie, TAS, 69024",20001
Salma,Huel,,866.885.1426,"Josh Mission, North Wyman, TAS, 47851",20002
Marlene,Hettinger,,1-888-391-3919,"Ahmad Branch, Padbergchester, QLD, 85379",20007
Helga,Lehner,,1-800-650-4517,"Orn Mall, South Mikefurt, QLD, 65174",20002
Euna,Witting,,(855) 699-3185,"Zita Divide, Lindland, NSW, 63342",20007
Kenneth,Abbott,,1-800-266-8918,"Buddy Parkways, Zorachester, QLD, 88727",20007
Gilberto,Lowe,,(866) 233-7288,"Brenda Spur, Port Henry, QLD, 41749",20004
Serena,Glover,,855.871.9557,"Lyda Pine, Macejkovicville, TAS, 85386",20004
Catharine,Wolff,,(866) 434-7793,"Elsa Alley, Vancechester, SA, 50790",20007
Bridgette,Miller,,844-797-5587,"Krajcik Crescent, Maximilianville, WA, 58940",20001
Brandy,Cormier,,(800) 485-9081,"Crona Port, Immanuelmouth, SA, 68714",20007
Porter,Beer,,855.834.8034,"Zulauf Lodge, Wizaville, NSW, 84858",20004
Arnold,Hartmann,,1-844-390-1464,"Jenkins Mill, Constanceland, NSW, 53516",20006
Khalil,Stiedemann,,855-714-6793,"Ruben Mountain, New Ashleighchester, WA, 71685",20002
Henderson,Gibson,,844-988-1486,"Aufderhar Plain, Port Eulahville, ACT, 48511",20003
Bryon,Maggio,,(888) 365-8491,"Erna Port, West Colehaven, NSW, 8331",20001
Una,Romaguera,,877.382.5045,"Fadel Views, Lakinside, NT, 47729",20003
Larry,Terry,,1-866-226-2826,"Nigel Station, West Tateberg, TAS, 76575",20005
Maxie,Konopelski,,1-866-656-8152,"Dedric Island, New Lafayetteside, TAS, 79151",20002
Coby,Berge,,844.517.1075,"Jarret Wall, Considineberg, ACT, 92744",20006
Zella,Rempel,,888-396-7748,"Cleo Roads, Erynmouth, TAS, 20544",20005
Stanford,Goyette,,(855) 369-9320,"Wolff Brook, East Keaton, NT, 16623",20002
Katelynn,Huels,,1-877-899-8396,"Juliana Port, Moorehaven, VIC, 66513",20007
Kade,Beatty,,877.882.5154,"Darby Expressway, Lake Ashley, ACT, 13381",20007
Hermina,Robel,,855.528.1223,"Kunze Garden, West Estefania, NT, 61200",20001
Margot,Von,,877-338-0690,"Jakubowski Rapids, West Maxwell, QLD, 47556",20004
Bertram,Veum,,1-844-794-3987,"Barry Underpass, East Twila, SA, 8452",20003
Lexus,Fritsch,,877-626-5106,"Kirlin Gardens, Lake Lindseychester, ACT, 53701",20005
Erich,Ratke,,844.802.3428,"Mraz Station, Lake Crystel, QLD, 3083",20006
Adeline,Wiza,,1-800-230-5429,"Schmidt Stream, West Arnoldville, ACT, 28969",20005
