first_name,last_name,email_address,mobile_no,address,contact_owner_id
Cristopher,Ward,,888.817.6609,"Lebsack Fall, North Jaime, NT, 62920",20002
Daniella,Kilback,,1-877-689-9372,"Rosanna Trail, South Eli, TAS, 89115",20005
Koby,Casper,,(800) 223-9199,"Leanna Cliffs, North Jacky, QLD, 6219",20006
Liza,Terry,,1-844-378-2089,"Eichmann Center, Randyview, NT, 23163",20007
Berry,Dach,,(888) 624-4261,"Gusikowski Bridge, South Russside, NSW, 93884",20004
Izabella,Trantow,,1-877-240-9861,"Smitham Orchard, Lake Astridport, TAS, 42282",20006
Anibal,Beier,,1-866-656-5925,"Nitzsche Lights, East Yvonneshire, TAS, 2356",20005
Anabelle,Schultz,,877.902.6941,"Sherwood Plaza, Port Emiliemouth, WA, 43889",20002
Quinton,West,,877-462-5643,"Leonie Dale, New Hal, NSW, 71569",20004
Tia,Nikolaus,,855.519.7168,"Alena Walk, West Mckenna, VIC, 86690",20001
Reagan,Luettgen,,877.610.6070,"Lexus Circles, Gottliebfurt, VIC, 50375",20005
Dean,Feil,,888.879.6219,"Kirsten Mountain, Port Alvertaport, SA, 82952",20005
Cleo,Hilpert,,888-893-4709,"Dare Brook, South Donatoside, VIC, 5393",20002
Carley,Moore,,844.573.6938,"Leopold Lights, South Harmony, VIC, 22276",20004
Daphney,Carroll,,1-855-572-6758,"Tina Forge, Lake Jacksonton, SA, 59545",20005
Emilio,Walker,,1-877-671-1164,"Gerry Center, Donnellymouth, ACT, 55892",20002
Westley,Braun,,1-888-616-0635,"Eliseo Extension, Port Royce, SA, 98929",20007
Dorian,Dickinson,,(800) 450-0895,"Deontae Flat, Goodwinport, TAS, 88778",20003
Blanca,Gislason,,866.768.9469,"Stephanie Unions, East Maryburgh, SA, 35959",20004
Brenden,Collins,,844-402-0442,"Mikayla Cliffs, New Alana, ACT, 20801",20007
Audreanne,Grady,,844.844.3283,"Chasity Square, Vellaport, NSW, 73748",20001
Daisha,Cummings,,866-839-3044,"Zulauf Corners, Port Jany, QLD, 35143",20002
Roman,Glover,,(844) 840-8966,"Anderson Crest, Port Jacyntheview, QLD, 25454",20006
Jadon,Roob,,866-565-3364,"Curtis Overpass, Turnerborough, ACT, 31664",20001
Trinity,Maggio,,(877) 546-2062,"Lang Pine, North Leachester, ACT, 88946",20004
Elisabeth,Olson,,1-877-958-5584,"Johns Rapid, South Salvador, NT, 60201",20001
Felicita,Swift,,(844) 477-2879,"Considine Isle, Port Gregorio, TAS, 55532",20006
Lyla,Walker,,800.539.3667,"Audra Springs, Nedrashire, SA, 61758",20003
Josh,Wilderman,,1-800-388-6987,"Zieme Estate, Stephanport, WA, 87422",20006
Chandler,Bartoletti,,1-800-487-7980,"Kuhlman Highway, South Toby, TAS, 38247",20004
Cornelius,Nitzsche,,866.339.3997,"Gerhold Terrace, Donnellfurt, NT, 87538",20003
Callie,Hegmann,,(844) 620-9337,"Becker Wall, New Novella, WA, 26803",20007
Zoila,Borer,,(800) 463-5220,"Batz Springs, Shieldsstad, TAS, 35809",20001
Carlee,Labadie,,1-888-812-3040,"Jovan Key, Martyfort, VIC, 16771",20004
Arely,Welch,,1-866-690-3514,"Eric Plains, North Christ, NSW, 67030",20004
Tre,Conroy,,844-769-4996,"Adams Tunnel, Port Malvinaland, QLD, 72096",20004
Adrianna,Kuhn,,866-819-3312,"Heathcote Grove, North Lydiaside, WA, 30341",20003
Delbert,Dickinson,,1-866-350-1978,"Alize Union, Alffort, VIC, 20050",20002
Jasper,Prohaska,,(800) 548-3175,"Gonzalo Garden, Raynorstad, NSW, 30146",20001
Vivienne,Nienow,,1-888-252-7744,"Vandervort Place, Mozellberg, TAS, 47165",20003
Wendy,Walsh,,866.658.6577,"Barton Burgs, Marisaborough, NT, 97474",20003
Shakira,Christiansen,,866-563-0431,"Gulgowski Station, Port Mervin, NSW, 56529",20002
Shakira,Kulas,,(866) 383-1404,"Mohamed Springs, Skilesside, TAS, 76502",20006
Faustino,Stamm,,(855) 241-4227,"Marisa Ville, Lake Sheridan, NT, 91912",20002
Garnett,Shanahan,,855-205-9510,"Ullrich Well, North Desireemouth, SA, 45055",20001
Elise,Toy,,(888) 459-1163,"DuBuque Stravenue, South Esthermouth, VIC, 10229",20005
Jovany,Altenwerth,,800-933-4334,"Lucile Lodge, Grahammouth, WA, 70925",20005
Myrtie,Pfannerstill,,844.824.1322,"Raynor Grove, North Verlie, NT, 12329",20002
Sammie,Hagenes,,866.883.3988,"Breitenberg Locks, Roslynmouth, NT, 27898",20002
Sidney,Konopelski,,800.909.3969,"Caesar Green, West Justenborough, VIC, 49194",20002
Meta,Wiegand,,1-888-414-1326,"Lehner Locks, Hirtheville, TAS, 57708",20002
Tavares,Gerhold,,877.394.3552,"Shania Islands, Josephview, WA, 39295",20005
Graham,Stroman,,855.235.3664,"Gislason Landing, Lake Manuelachester, QLD, 52779",20001
Hector,Bruen,,888.930.7468,"Alberta Rue, Dellview, SA, 28090",20005
Darren,Cole,,866-875-8519,"Kuphal Track, Filibertomouth, QLD, 19392",20003
Elwin,Buckridge,,888-947-2324,"Kilback Spur, Sadyetown, VIC, 76696",20006
Gage,Ratke,,844.438.8017,"Andreane Forks, Websterport, TAS, 90421",20005
Nia,Tillman,,1-888-996-4646,"Tillman Springs, North Pierretown, TAS, 31298",20007
Ola,Keeling,,800.986.7719,"Nolan Islands, Morissettechester, QLD, 45847",20003
Amie,Doyle,,888.469.4707,"Augustus Mills, Port Emilymouth, VIC, 72230",20001
Gillian,Hagenes,,877-405-8134,"Nola Streets, Carlieborough, NSW, 8035",20003
Beulah,Marvin,,877.797.4470,"Nico Views, East Jacey, WA, 33018",20007
Angus,Schuppe,,866-591-3975,"Delta Isle, South Maddisonborough, ACT, 37822",20007
Brayan,Schaden,,(866) 718-6759,"Wisozk Shores, Lake Adrienne, QLD, 43809",20001
Bill,Cartwright,,800.633.8376,"Josephine Hills, South Josephinemouth, ACT, 55734",20003
Sammie,Williamson,,800.228.0132,"Ashley Lock, Port Creola, WA, 38474",20001
Audreanne,Lakin,,1-866-277-8928,"Wilber Landing, North Giovannishire, VIC, 71290",20001
Bobbie,Mertz,,(855) 410-9842,"Jacobi Keys, West Janelle, NT, 90104",20001
Rosalind,Schuppe,,855.219.3908,"Carole Ways, Wernerport, NSW, 85520",20004
Desiree,Batz,,(844) 212-7360,"Adrain Estate, Port Lucinda, VIC, 68406",20005
Jada,Lubowitz,,1-877-736-6536,"Langworth Ridges, New Zitatown, ACT, 92348",20004
Marcos,Heathcote,,(888) 907-0349,"White Squares, South Ovafort, QLD, 4424",20003
Dimitri,Emmerich,,877.200.9644,"Powlowski Port, West Lukasshire, QLD, 24853",20004
Tillman,Dicki,,844.458.3595,"Janelle Harbor, Yundtborough, WA, 87590",20005
Olin,Willms,,1-866-821-3575,"Kayley Neck, North Caitlyn, ACT, 89440",20004
Shakira,Connelly,,1-800-457-3259,"Mayert Place, Zemlakville, NSW, 94800",20003
Estell,White,,(877) 282-3296,"Devonte Track, Lake Anneshire, QLD, 38794",20006
Fred,Pouros,,1-877-536-8996,"Betsy Mount, Port Leslie, VIC, 52408",20001
Juliana,Koelpin,,866-743-1106,"Amara Bypass, Lake Lupe, SA, 43075",20005
Jaime,Ratke,,877-350-2056,"Yundt Hill, Gaylordbury, TAS, 63010",20005
Coty,O,,1-877-651-0306,"Harrison Walk, Groverbury, NSW, 30126",20002
Lionel,Borer,,844-994-7926,"Hoppe Locks, West Beaulahfort, NSW, 5695",20005
Sterling,Hauck,,1-877-203-2519,"Luna Well, Lake Khalid, WA, 5944",20005
Jakayla,Donnelly,,(888) 274-3942,"Evangeline Green, Funkshire, ACT, 32635",20005
Amelia,Marquardt,,1-844-383-5272,"Marie Underpass, New Garth, QLD, 88653",20007
Everett,Hill,,(844) 669-6205,"Noemi Mountain, South Reesemouth, TAS, 15973",20005
Vivian,Glover,,877.747.4172,"Maya Ranch, East Gennaro, TAS, 48032",20006
Jordon,Schiller,,1-888-869-3022,"Carolina Shoal, New Kolbymouth, VIC, 98381",20007
Jasen,Bogisich,,(877) 393-4623,"Koelpin River, East Blanche, NSW, 33242",20007
Aric,Parker,,(800) 600-8299,"Hills Orchard, Mrazmouth, QLD, 81037",20005
Corine,Fadel,,1-800-651-8351,"Ariane Highway, West Alberto, NSW, 81286",20007
Davin,Konopelski,,866-638-8190,"DuBuque Street, Doylebury, WA, 17281",20002
Emmie,Barrows,,(844) 656-1734,"Bianka Pike, Gibsonmouth, VIC, 13906",20001
Carmine,Baumbach,,1-866-819-0847,"Spencer Vista, North Eliseofort, TAS, 8174",20005
Zachary,Ferry,,1-888-963-1766,"Robel Trail, New Kevinmouth, SA, 3349",20005
Ansel,Gutkowski,,1-888-787-5551,"Miguel Neck, North Wilton, TAS, 93232",20001
Jordon,Leuschke,,877-822-1964,"Schaden Mission, West Ella, QLD, 20245",20007
Norris,Senger,,866.625.9624,"Zella Shoal, Murrayport, WA, 16278",20004
Genesis,Bahringer,,877-260-6710,"Jude Islands, New Felicitamouth, TAS, 95078",20002
Carey,Torp,,888.750.1297,"Monroe View, Riceton, VIC, 77296",20006
Erik,Hermiston,,1-877-530-7874,"Celine Walk, Bradtkebury, QLD, 68871",20004
Abner,VonRueden,,(855) 416-2810,"Daugherty Locks, South Zandermouth, SA, 26572",20007
Nicholas,Moen,,1-866-235-0260,"Braun Fords, Horaciostad, NT, 98610",20004
Woodrow,Lowe,,877-576-4846,"Buckridge Extensions, South Destany, ACT, 7505",20007
Toby,Torphy,,(866) 689-0864,"Makenzie Prairie, North Rowenastad, WA, 47060",20001
Gertrude,Waters,,844-288-5962,"Marguerite Garden, South Rosemarieberg, VIC, 65096",20004
Kelley,Nienow,,855.786.5895,"Shanahan Mission, Rogahntown, VIC, 70339",20002
Mathilde,Kertzmann,,1-844-542-4122,"Will Loaf, Lemkemouth, QLD, 86346",20002
Alessandra,Kertzmann,,1-844-357-2821,"Caleb Stream, North Alysa, NT, 61924",20004
Cassie,Kemmer,,1-866-687-6004,"Kiera Vista, Jailynhaven, SA, 36925",20003
Kristy,Konopelski,,1-866-377-5770,"Dameon River, Hanemouth, NT, 65491",20005
Candace,Nader,,888.774.9048,"Jones Lights, Betsymouth, QLD, 92036",20005
Reyes,Maggio,,844.580.7570,"Rau Falls, West Terence, WA, 69922",20001
Mikayla,Wiegand,,(855) 567-3127,"Lucio Rapids, South Ludie, SA, 99330",20005
Tianna,Heathcote,,(866) 565-7243,"Reggie Crossroad, East Mariahview, TAS, 58226",20005
Katelin,Schinner,,877.509.5688,"Savannah Village, New Cydneyshire, VIC, 3092",20001
Opal,Auer,,1-866-587-0917,"Keebler Mission, Lockmanside, VIC, 70208",20007
Imogene,Robel,,888.718.9596,"Abbott Harbors, East Doris, ACT, 17696",20002
Fredy,Becker,,1-877-836-1363,"Odessa Drives, Howellside, VIC, 19530",20002
Andrew,Jakubowski,,888.676.0313,"Fay Manor, Bergstrombury, WA, 88370",20007
Trey,Goyette,,855.975.7153,"Jones Inlet, North Zelma, SA, 61345",20001
Lisa,Frami,,866.659.0565,"Sporer Shore, Port Frederik, WA, 22407",20006
Giovanna,Hermann,,1-888-338-6684,"Grant Cape, Tillmanview, SA, 98447",20002
Tyreek,Kuhic,,1-877-570-9988,"Elsa Station, South Dinatown, QLD, 75962",20006
Jacynthe,Nikolaus,,877.787.7792,"Witting Camp, East Dallasburgh, TAS, 23549",20003
Mittie,Reichel,,844-258-2550,"Tavares Plains, Lake Monica, SA, 89559",20003
Wallace,Collier,,877.613.6244,"Joanny Run, Port Joany, NSW, 35365",20007
Noelia,Smith,,866-484-9007,"Schowalter Bypass, Paxtonfurt, WA, 60644",20003
Jeromy,Stokes,,(855) 867-0887,"Christop Forges, North Luciemouth, ACT, 28759",20006
Fanny,Abshire,,(877) 937-6479,"Demarcus Burg, Leilaview, VIC, 77966",20004
Dayna,Reynolds,,(844) 538-7348,"Coby Islands, Lake Leopoldtown, NSW, 51812",20003
Abdiel,Kerluke,,844.256.9074,"Earl Divide, Port Rachelburgh, NT, 70857",20006
Tristian,Kilback,,800.439.7127,"Turcotte Run, South Alvinaberg, NSW, 92748",20001
Willie,Torphy,,800.754.0439,"Amelia Shoal, Emilieberg, WA, 67864",20002
Eda,Kuhn,,1-866-420-1890,"Greg Wall, Spinkaview, QLD, 43771",20002
Victoria,Legros,,877-650-7597,"Dietrich Mountains, West Missouriland, QLD, 12561",20003
Petra,Predovic,,(844) 563-9385,"Borer Keys, Lehnerport, NT, 1581",20003
Norris,Schiller,,(844) 939-9509,"Leon River, Lake Felixburgh, NT, 48864",20004
Jaden,Watsica,,1-888-869-4059,"Veum Freeway, Enolaport, SA, 80294",20007
Crystal,Yost,,855-898-5838,"Ransom Mews, New Morton, SA, 2894",20005
Amanda,Klocko,,855-984-7561,"Earline Park, Port Americo, TAS, 41473",20001
Matilda,Deckow,,855.298.9893,"Deborah Shoals, West Malvinaborough, NSW, 18580",20005
Judy,Leannon,,1-800-700-0390,"Sydnee Via, Thaddeusmouth, QLD, 22187",20002
Darion,Tromp,,1-866-820-8718,"Gutmann Lights, West Aylintown, NT, 91953",20007
Samantha,Turner,,888.478.8737,"Wintheiser Mountain, Lake Kane, ACT, 35585",20002
Ernesto,Leffler,,844-542-3657,"Hagenes Station, Karleeshire, TAS, 50489",20006
Donnell,Reilly,,(866) 322-6904,"Collins Walk, New Clarabelleton, ACT, 17006",20001
Maud,Harris,,1-866-510-5553,"Vandervort Bridge, New Aliyahbury, NSW, 7215",20005
Maurine,Rippin,,888-364-6557,"Alexane Meadows, Malindaville, NSW, 85491",20001
Elyse,Blanda,,(866) 495-5530,"Thiel Heights, West Kellyfurt, VIC, 64218",20004
Gia,Smith,,1-800-598-2120,"Reichel Lodge, Keeblerstad, NT, 97131",20003
Kirsten,Bruen,,888-504-8402,"Orville Manors, Hansenbury, VIC, 43694",20002
Kelli,Schowalter,,(844) 691-7718,"Corkery Avenue, East Jamiefurt, QLD, 32821",20007
Eileen,Emard,,888-783-7321,"Berge Throughway, North Paula, SA, 8861",20003
Davin,Smith,,(800) 879-5470,"Valerie Mountains, Keyshawnfurt, VIC, 2160",20006
Marisol,D,,(877) 226-4637,"Trevion Views, North Schuylerburgh, ACT, 21363",20004
Vernie,Grady,,877-229-7315,"Heidenreich Hills, Lueilwitzbury, NT, 11013",20006
Brendon,Corkery,,800-575-4147,"Fredy Road, Welchbury, ACT, 81544",20003
Lillian,Walker,,(800) 650-8872,"Medhurst Knolls, Uptonhaven, SA, 54474",20006
Eliezer,Schiller,,1-844-610-0758,"Hillary Way, Eloisahaven, ACT, 69091",20003
Sierra,Marvin,,1-844-698-9735,"Felipe Shores, East Amarichester, QLD, 46420",20001
Conor,Farrell,,877-390-9429,"Eliane Summit, North Aniyaview, VIC, 74181",20005
Aurelia,Hermann,,844.732.8101,"Leffler Greens, Arliefort, QLD, 3049",20006
Tania,Dicki,,800.897.0721,"Schamberger Via, West Groverstad, SA, 28927",20001
Rosie,Langosh,,844.660.6639,"Goodwin Overpass, South Zena, TAS, 93144",20001
Leonardo,Lakin,,877.976.7812,"Ebert Crest, Bayleefurt, VIC, 26247",20007
Troy,Zboncak,,855-668-7845,"Rosenbaum Estate, New Rodgerchester, SA, 6335",20002
Jaleel,Schaefer,,800-853-3846,"Loraine Roads, Robelview, WA, 98713",20002
Jamaal,Ebert,,(888) 491-1715,"Bode Squares, Abbottfurt, TAS, 67843",20004
Faye,Torp,,888.981.0880,"Mya Viaduct, Estaport, SA, 59634",20007
Nora,Raynor,,800.354.0534,"Diana Views, West Stevefurt, ACT, 73556",20004
Lydia,Orn,,(877) 752-3432,"Sauer Passage, Christelleside, NT, 25069",20005
Aisha,Lind,,800-835-3647,"Elisha Burgs, Port Erictown, QLD, 2132",20004
Arnold,Tremblay,,877-971-0222,"Minnie Turnpike, West Emersontown, WA, 60543",20006
Tianna,Maggio,,800.763.5528,"Schumm Lodge, Reichertburgh, TAS, 31168",20003
Hubert,Eichmann,,(800) 341-4191,"Stanton Camp, Yasminborough, NT, 86100",20002
Meagan,Gleason,,855-486-8024,"Blanda Street, New Magnolia, TAS, 22509",20005
Amely,Lowe,,1-877-708-8952,"Deonte Expressway, Dickinsonborough, ACT, 23485",20003
Breana,Schiller,,(877) 721-2214,"Breitenberg Ville, Ledashire, NSW, 27830",20002
Caleb,Konopelski,,800.454.5727,"Moriah Avenue, North Cecile, QLD, 71693",20003
Alphonso,Davis,,1-855-255-3570,"Olson Shoal, West Einarmouth, QLD, 16119",20007
Reva,Wuckert,,1-855-413-9970,"Rowland Tunnel, Lake Chaunceymouth, ACT, 79772",20007
Rosemarie,Schulist,,1-888-476-8884,"Freeda Avenue, North Sheachester, NT, 47433",20007
Lorenz,Ratke,,866-255-2372,"Gusikowski Isle, Laishabury, WA, 11312",20002
Cyrus,Kreiger,,888-287-1709,"Jonas Village, Port Eldastad, TAS, 41050",20004
Brent,Muller,,(877) 406-7317,"Auer Roads, Estelfort, NT, 18511",20004
Perry,Goodwin,,866.930.3875,"Keebler Roads, Millieberg, NSW, 27921",20002
Iliana,Trantow,,888.848.2913,"Wehner Valleys, Juddshire, NSW, 86097",20007
Joanne,Hills,,(888) 690-1754,"Garrett Trail, Port Lenna, WA, 63386",20004
Gerard,Spencer,,877-673-8325,"Russell Mission, Ritchiestad, NSW, 3573",20004
Dexter,Crona,,(877) 499-8309,"Stamm Ridge, North Maritza, SA, 3783",20006
Clay,Heathcote,,855-302-8785,"Tremaine Extension, East Bridgette, SA, 54774",20007
Eusebio,Schinner,,(877) 962-1733,"Rupert Falls, Hirthemouth, QLD, 65189",20002
Linda,Kunde,,877-449-5045,"Taya Ports, Walshtown, NSW, 8705",20002
Kelley,Johnston,,888-971-6486,"Adonis Walks, Port Orlandotown, NSW, 4936",20004
Saige,Konopelski,,1-800-330-4660,"Sebastian Pass, New Agustinaport, NT, 67559",20004
Ford,Bruen,,844-246-0652,"Weimann Turnpike, New Kayla, NSW, 141",20004
Madelynn,Larkin,,(866) 438-6173,"Yazmin Heights, New Nellashire, SA, 15618",20001
Alvera,Beatty,,844-238-8598,"Enos Common, Barrowston, NSW, 13479",20005
Evans,Corkery,,(844) 379-3534,"Victor Tunnel, Baileystad, NT, 10561",20002
Elbert,Jenkins,,1-888-783-8172,"Allie Harbors, Dawsonstad, WA, 74473",20003
Alexzander,Ferry,,866.352.7931,"Schimmel Street, Morrisburgh, QLD, 47297",20004
Warren,Gottlieb,,877.492.5249,"Raul Point, Kossville, WA, 96096",20007
Joe,Crooks,,1-855-584-9598,"Lelah Run, West Aliaport, ACT, 35331",20003
Delores,Erdman,,(844) 576-1863,"Farrell Trail, Lake Rosieport, NSW, 16113",20002
Rosalyn,Pfeffer,,800.428.2641,"Zoey Ford, Ellsworthfort, VIC, 43468",20003
Itzel,Jaskolski,,800.518.3747,"Erling Plain, Myrtieshire, NT, 47634",20005
Norris,Sipes,,1-855-384-9987,"Alize Pine, Lake Dorianville, TAS, 87137",20007
Clifford,Haag,,855-756-1763,"Terrell Manor, Lake Chloeland, NT, 82360",20006
Diamond,Marvin,,(888) 486-8478,"Lincoln Fall, Hickleville, WA, 57586",20001
Jerome,D,,1-800-529-7823,"Breitenberg Valley, New Matildamouth, SA, 91636",20005
Darrell,Jakubowski,,877-958-5744,"Clementina Coves, Gleasonhaven, QLD, 30353",20007
Melissa,Daugherty,,866.647.6482,"Douglas Estate, Londonchester, QLD, 94386",20003
Kari,Greenholt,,877-700-7279,"Kulas Springs, Bogantown, TAS, 73956",20007
Monserrat,Breitenberg,,844-216-5595,"Runte Junction, New Hermannborough, TAS, 5107",20003
Dannie,Jakubowski,,888.947.4581,"Hand Causeway, East Karolannview, ACT, 5861",20006
Brandt,Hilpert,,888-755-2480,"Kiehn Roads, Stiedemannview, WA, 51521",20002
Curt,Dickinson,,855-897-7754,"Nella Springs, Port Francescoshire, VIC, 15989",20001
Jude,Emmerich,,877.302.5334,"Okuneva Pike, Scarlettville, NT, 20452",20001
Zaria,Denesik,,888-665-9367,"Mikel Haven, Dachmouth, QLD, 40826",20003
Lorena,Friesen,,1-877-752-4533,"Rosanna Extensions, Selinaville, ACT, 17246",20006
Riley,Hane,,855.391.6061,"Medhurst Plaza, Rennerton, VIC, 26950",20006
Brent,Daniel,,855.560.2097,"Kareem Throughway, Heathcotehaven, NSW, 45983",20004
Marie,Dickinson,,(888) 901-7881,"Rolfson Neck, Heidenreichbury, SA, 43432",20003
Zelma,Schaefer,,1-855-513-6035,"Toy Square, Mallieport, VIC, 36918",20003
Hershel,Nolan,,1-800-883-0722,"Mosciski Forge, New Juston, WA, 97268",20001
Shanny,Skiles,,(800) 215-4320,"Johnston Well, Jodiefort, SA, 55927",20007
Lucienne,Hansen,,1-855-884-6887,"Joe Mission, Schultzland, SA, 10028",20005
Salvatore,Crist,,855-621-4971,"Littel Meadows, Schadenburgh, TAS, 1854",20005
Darrin,Nolan,,844.219.7482,"Anibal Squares, Port Chasity, NSW, 83995",20007
Roderick,Moore,,877.446.1201,"Josianne Lodge, Port Jarrett, QLD, 32933",20004
Cordie,Kozey,,(855) 989-9061,"Jovan Key, East Brendashire, NT, 82731",20001
Jazmin,Fadel,,844-874-8442,"Alejandra Islands, Rathborough, QLD, 19891",20007
Eudora,Langworth,,(877) 340-9306,"Robbie Unions, Port Lilla, SA, 93013",20007
Stephon,Buckridge,,844-562-3816,"Mitchell Throughway, Bauchbury, ACT, 27145",20002
Kathleen,Waelchi,,(855) 818-5847,"Walter Via, Abeberg, ACT, 84583",20007
Ali,Heathcote,,(866) 727-7570,"Nyah Falls, East Enaburgh, SA, 43838",20007
Damaris,Smitham,,855.649.1932,"Shanel Lakes, Mohrside, NSW, 78728",20007
Alessandra,McClure,,(888) 443-3724,"Rachel Ford, Bergstromfurt, WA, 48334",20002
Erika,Tromp,,800-862-2650,"Noemy Ports, North Ricostad, WA, 86484",20001
Maia,Hartmann,,888-884-3921,"Hallie Centers, South Mariam, VIC, 48752",20004
Maxime,Gulgowski,,800-518-1231,"Corkery Bridge, Wilmerfurt, NSW, 44107",20006
Keeley,Marquardt,,855-449-9853,"Miracle Loop, North Ralph, SA, 82203",20002
Chloe,Wisozk,,877-844-3392,"Anissa Grove, Nolanberg, QLD, 36999",20007
Nat,Beier,,(800) 865-3895,"Friesen Avenue, South Corene, WA, 5919",20001
Fabian,Turner,,888.368.7000,"Klein Pass, North Christianfort, ACT, 13649",20005
Tomasa,Hodkiewicz,,1-844-322-5535,"Cale Forest, West Karli, NSW, 34575",20001
Archibald,Little,,(888) 306-2855,"Emily Islands, Port Lyla, NSW, 55324",20004
Charlotte,Lesch,,(877) 374-5245,"Predovic Mission, Lake Arnaldo, VIC, 9505",20001
Connor,Bernier,,1-855-410-8648,"Nikolas Springs, Port Rosaleeport, QLD, 79762",20007
Bernita,Murazik,,877.203.3939,"Bartell Curve, Bellatown, NSW, 84862",20005
Adelbert,Ryan,,855.516.9624,"Chasity Island, Wellingtonton, ACT, 50826",20001
Caleigh,Green,,866-436-6832,"Stoltenberg Course, Londonville, NSW, 79253",20003
Jaylon,Moore,,866-306-5948,"Bashirian Unions, Rogahntown, ACT, 61635",20005
Hildegard,Klein,,1-800-376-4608,"Altenwerth Grove, Laurinechester, NT, 91849",20006
Zita,Kulas,,(855) 293-7867,"Mueller Stravenue, Lake Marjolaine, WA, 77579",20004
Keenan,Harber,,1-888-990-1676,"Heathcote Shores, East Dillon, NSW, 75706",20006
Nola,Cormier,,(888) 624-3034,"Baumbach Field, Efrainville, SA, 81976",20003
Albertha,Fahey,,877.274.0307,"Theresia Isle, Aglaeview, QLD, 60509",20006
Blaise,Collins,,1-877-670-1920,"Heller Lakes, Preciousborough, NT, 61903",20005
Lilly,Hand,,1-855-662-0253,"Emmerich Manor, Port Grace, NT, 85413",20006
Kiana,Conn,,877-616-5750,"Torrey Center, Schroederview, NSW, 47468",20004
Jonathan,Zboncak,,(800) 562-3343,"Mohr Shoal, Brannonland, VIC, 5511",20001
Margarete,Turner,,1-866-895-0005,"Marjory Divide, West Heathshire, ACT, 77852",20006
Maudie,Kub,,(844) 646-9501,"Brent Locks, Eusebioport, WA, 70005",20007
Irving,DuBuque,,866.428.3993,"Rolfson Ford, Joshuahchester, NSW, 19113",20005
Brenden,Greenholt,,1-888-520-7929,"Rosie Station, Rogahnhaven, ACT, 22360",20006
Talia,Berge,,866-272-9554,"Adolphus Branch, New Mekhi, NT, 83882",20001
Faustino,Padberg,,(844) 282-5593,"Gerardo Key, Funkmouth, QLD, 51711",20004
Tiffany,Rolfson,,(800) 556-6309,"Miller Hill, Sophiaville, ACT, 67124",20002
Antonietta,Russel,,(800) 651-1373,"Tressa Walks, Gerlachview, QLD, 73919",20001
Otilia,Johnston,,(888) 771-4276,"Dare Pines, Abigayletown, TAS, 72152",20002
Kacie,Abbott,,1-844-703-0599,"Labadie Forge, East Isaac, SA, 95579",20004
Mona,Kiehn,,844.850.3065,"Rath Path, New Gregory, ACT, 87300",20003
Dayne,Johnson,,(855) 866-3923,"Mozell Union, Ezequielmouth, WA, 7671",20007
Nola,Kerluke,,(877) 854-8560,"Kemmer Spring, North Bettyeborough, NSW, 51093",20003
Nicola,Welch,,855.963.9583,"Minnie Plains, West Blancastad, WA, 34329",20002
Antwon,Pacocha,,844-330-7079,"Brandon Forges, West Hughhaven, SA, 53739",20006
Vella,Mraz,,866.264.4004,"Kirlin Ville, New Laverneborough, VIC, 63309",20002
Vergie,Mills,,1-877-290-0727,"Franecki Groves, South Simone, WA, 5236",20002
Dallin,Brakus,,1-800-470-2082,"Zane Row, Oswaldoside, NT, 79497",20004
Kylee,Emmerich,,844.482.2591,"Lehner Club, Goldenport, TAS, 58041",20006
Earnestine,Wilderman,,800.516.5095,"Winifred Square, North Ericaview, WA, 10741",20003
Cielo,Gerhold,,1-855-944-1882,"Henriette Estates, Port Graceside, QLD, 57542",20007
Angelica,Ratke,,877.649.2982,"Zola Corners, Elwintown, WA, 20944",20002
Melyna,Tromp,,844.773.5971,"Bayer Course, Jastmouth, WA, 77581",20002
Merlin,Torp,,(855) 717-9818,"Enos Bypass, East Dessieland, ACT, 70119",20004
Micheal,Emard,,877.453.0037,"Daisy Keys, Jastshire, WA, 36627",20002
Lavinia,Hermiston,,855-568-8988,"Olson Parkways, Kendallburgh, ACT, 83745",20001
Oda,Klocko,,1-844-626-2891,"Mellie Stravenue, East Paulmouth, VIC, 65932",20007
Gregoria,Murphy,,877.276.8092,"Woodrow Run, East Brandon, NT, 54056",20006
Jaiden,Cruickshank,,800.446.8268,"O'Connell Mills, Ebonymouth, TAS, 63267",20001
Keenan,Lynch,,1-866-908-4314,"Ankunding Street, West Kristinton, TAS, 44710",20002
Dashawn,Mayert,,1-800-826-8614,"Gibson Villages, Port Lorenz, TAS, 82751",20004
Beau,Rodriguez,,855-341-4893,"Mayert View, Lueilwitzhaven, QLD, 22494",20006
Thora,Brown,,(888) 496-9649,"Clovis Estate, Lemkestad, NSW, 60847",20004
Dorris,Johnson,,888.866.2315,"Runolfsson Shore, New Huldachester, TAS, 36714",20003
Martin,Brown,,1-844-634-5556,"Gibson Way, New Shad, NT, 1628",20002
Kelly,Quigley,,855-229-0292,"Olin Rapid, Lake Waldoland, NSW, 50296",20007
Loyce,Douglas,,800-836-4370,"Judd Corner, Maziechester, WA, 75426",20006
Germaine,Crona,,844-600-9751,"Kuhn Station, North Elvis, SA, 22378",20003
Robbie,Block,,(800) 847-5019,"Kyler Creek, Stantonburgh, VIC, 39972",20001
Litzy,Cormier,,(844) 763-5542,"Dickinson Mountains, New Amyaport, WA, 35793",20006
Madelyn,Yundt,,844-312-7733,"Sandy Causeway, Jaskolskibury, SA, 31562",20001
Stevie,Beier,,(844) 856-6379,"Wisoky Junctions, Stammfurt, ACT, 69892",20001
Harmony,Reinger,,1-844-702-3745,"Schmeler Way, East Ashleigh, WA, 76834",20005
Alyce,Wunsch,,866-794-1111,"Florian Alley, Drakebury, NT, 61538",20007
Rey,Grant,,877-478-2180,"Warren Spur, North Gene, TAS, 95402",20001
Derrick,Macejkovic,,(855) 597-2787,"Brisa Wells, Vernicefort, QLD, 13363",20001
Alexanne,Spencer,,1-844-888-8685,"Braun Springs, Jadenfurt, TAS, 62979",20004
Clemmie,Krajcik,,1-844-543-1829,"Paige Extensions, Thompsonport, WA, 13258",20001
Jody,Halvorson,,888-517-7372,"Kunze Springs, Wallacemouth, ACT, 73300",20004
Juvenal,Von,,855.460.5497,"Keeley Street, Parisside, ACT, 45087",20003
Beryl,Purdy,,844.696.1373,"Wiza Walks, Germanmouth, SA, 3505",20002
Santina,Koch,,(877) 647-3072,"Becker Ville, Aliciatown, TAS, 92454",20006
Evangeline,Funk,,1-800-546-4183,"Effie Flats, Everettetown, SA, 11427",20006
Tevin,Hickle,,888-668-1072,"Spencer Forge, South Sophie, ACT, 27248",20005
Watson,Dietrich,,1-866-777-5281,"Ivy Path, Darenberg, WA, 17708",20005
Taya,Cummings,,866-843-4115,"Ulises Expressway, East Johathanfort, NT, 30862",20001
Anna,Little,,855.568.3571,"Jacobson Highway, West Rahsaanmouth, ACT, 17410",20005
Kamryn,Kertzmann,,1-877-471-2200,"Cornell Bypass, North Cleveland, VIC, 50575",20006
Katharina,Farrell,,866.212.3487,"Gleichner Corner, Nicolasshire, VIC, 10751",20001
Owen,Boehm,,(855) 359-1945,"Dayne Keys, West Granville, QLD, 79678",20006
Ramiro,O,,877-931-4223,"Treutel Mall, Ardithton, SA, 91393",20007
Schuyler,Kerluke,,1-800-517-6054,"Earnest Estate, Asiaborough, NT, 87542",20003
Jamil,Hoeger,,800.413.5807,"Kihn Lakes, North Asaview, VIC, 36307",20007
Adolphus,Russel,,(866) 478-8073,"Bahringer Summit, Trompfort, TAS, 27497",20001
Jaiden,Green,,1-855-472-7048,"Yasmin Inlet, East Ivory, NT, 93753",20001
Marquise,Towne,,(855) 459-8346,"Quinton Cape, Itzelborough, ACT, 36344",20001
Modesta,Durgan,,866-382-6345,"Pouros Drive, New Lauren, SA, 11303",20003
Heloise,Windler,,1-844-740-3949,"Aditya Knolls, North Robert, VIC, 13863",20003
